address_id,lat,lng,address,website,id,title,url,rating,categories.0.id,categories.0.parent_id,categories.0.root,categories.0.url,categories.0.title,categories.1.id,categories.1.parent_id,categories.1.root,categories.1.url,categories.1.title,image_url,premium,discount_id,discount_title,discount_image_url,discount_discount,discount_text,rating_stars,rating_number,rating_color,description,logo,categories.2.id,categories.2.parent_id,categories.2.root,categories.2.url,categories.2.title,categories.3.id,categories.3.parent_id,categories.3.root,categories.3.url,categories.3.title,categories.4.id,categories.4.parent_id,categories.4.root,categories.4.url,categories.4.title
16689,40.7172951,-74.0069891,"40 Worth St, New York, NY, United States, 10013",https://click.cryptwerk.com/company-website/16689/,15381,charity: water,charity-water,38.46,242,113,113,charity-organization,Charity organization,,,,,,s3:///prod/companies/charity-water_3d244ca7009d77ac5f7c865acac1ea8e.jpg,,,,,,,,1.9,2,"charity: water is a non-profit bringing clean and safe drinking water to people in developing nations. Since 2006, weve funded more than 64,000 water projects in 29 developing countries. When...",https://s3.cryptwerk.com/companies/charity-water_3d244ca7009d77ac5f7c865acac1ea8e.jpg,,,,,,,,,,,,,,,
16691,40.749962,-73.9829616,"401 5th Ave, New York, NY, United States, 10016",https://click.cryptwerk.com/company-website/16691/,15383,BtcShop4u,btcshop4u,30.77,110,9,9,souvenirs,Souvenirs,,,,,,s3:///prod/companies/btcshop4u_937b867b00fae4a73c8c13de8c40f2f7.jpg,,,,,,,,1.5,2,"In our store, you can buy many products at a discount with Bitcoin payment method. Also, there are big discounts up to 25%!  In this period when digital currencies are on the rise, we designed our...",https://s3.cryptwerk.com/companies/btcshop4u_937b867b00fae4a73c8c13de8c40f2f7.jpg,,,,,,,,,,,,,,,
16693,39.7483255,-122.1979067,"624 6th St, Orland, CA, United States, 95963",https://click.cryptwerk.com/company-website/16693/,15385,West Mitsubishi,west-mitsubishi,34.62,135,9,9,auto,"Auto, bikes, vehicles",,,,,,s3:///prod/companies/west-mitsubishi_27a7d56f530734c48e9a5c2c079fe81d.jpg,,,,,,,,1.7,2,"Are you struggling to find a dealership that will take care of your needs and wants for another vehicle? Our Mitsubishi dealerships near you are ready to help! When you come to West Mitsubishi,...",https://s3.cryptwerk.com/companies/west-mitsubishi_27a7d56f530734c48e9a5c2c079fe81d.jpg,,,,,,,,,,,,,,,
16696,43.659142,-79.5136266,"4243C Dundas St W, Toronto, ON, Canada, M8X 1Y3",https://click.cryptwerk.com/company-website/16696/,15388,EasyDNS,easydns,30.77,26,22,22,hosting,Hosting,,,,,,s3:///prod/companies/easydns_60628b336606dc325074b66189836ac9.jpg,,,,,,,,1.5,2,"EasyDNS Technologies Inc. is a Canadian Internet service provider which supplies DNS and Hosting services and operates a mail service called EasyMail.  Since 1998, easyDNS has set industry...",https://s3.cryptwerk.com/companies/easydns_60628b336606dc325074b66189836ac9.jpg,,,,,,,,,,,,,,,
16716,42.0459385,-87.6816838,"1563 Sherman Ave, Evanston, IL, United States, 60201",https://click.cryptwerk.com/company-website/16716/,15408,Fabretto Childrens Foundation,fabretto-childrens-foundation,34.62,242,113,113,charity-organization,Charity organization,,,,,,s3:///prod/companies/fabretto-childrens-foundation_113246a4a33449ebf9ba7a436173944a.jpg,,,,,,,,1.7,2,"Fabretto is a 501(c)(3) nonprofit organization supporting over 40,000 children in 8 Fabretto Education Centers and over 140 public primary schools in underprivileged rural and urban communities in...",https://s3.cryptwerk.com/companies/fabretto-childrens-foundation_113246a4a33449ebf9ba7a436173944a.jpg,,,,,,,,,,,,,,,
16722,39.3815799,-76.7920989,"9113 Sunset Ridge Rd, Randallstown, MD, United States, 21133",https://click.cryptwerk.com/company-website/16722/,15414,4MyCiTy,4mycity,23.08,242,113,113,charity-organization,Charity organization,,,,,,s3:///prod/companies/4mycity_95e7a82e0ff06e3e433a79598a8ee556.jpg,,,,,,,,1.2,2,,https://s3.cryptwerk.com/companies/4mycity_95e7a82e0ff06e3e433a79598a8ee556.jpg,,,,,,,,,,,,,,,
16734,29.9857411,-95.4149182,"500 Century Plaza Dr, Houston, TX, United States, 77073",https://click.cryptwerk.com/company-website/16734/,15426,Zobie Productions,zobie-productions,26.92,167,9,9,art,Art,,,,,,s3:///prod/companies/zobie-productions_3a13bcfe19001123f692a53b55cdbc97.jpg,,,,,,,,1.3,2,Zobie Productions provides Autograph Mail-in and Pre-Order services to events all over the world. We work with promoters and agencies in order to coordinate private and public signings allowing...,https://s3.cryptwerk.com/companies/zobie-productions_3a13bcfe19001123f692a53b55cdbc97.jpg,,,,,,,,,,,,,,,
16735,33.4329528,-111.8449346,"Mesa, AZ, United States, 85201",https://click.cryptwerk.com/company-website/16735/,15427,Three Angry Kids,three-angry-kids,23.08,201,9,9,beauty,Beauty,,,,,,s3:///prod/companies/three-angry-kids_9d5118ab65b3036bb0d76bb96536a11f.jpg,,,,,,,,1.2,2,"Three Angry Kids. This new brand has exciting new scents, great new products, and Cafe, restaurants, bars soaps created with Goats Milk. And like our VelociCrafter products, our new line is...",https://s3.cryptwerk.com/companies/three-angry-kids_9d5118ab65b3036bb0d76bb96536a11f.jpg,,,,,,,,,,,,,,,
16738,29.7604267,-95.3698028,"Houston, TX, United States",https://click.cryptwerk.com/company-website/16738/,15430,Built With Bitcoin Foundation,built-with-bitcoin-foundation,23.08,242,113,113,charity-organization,Charity organization,,,,,,s3:///prod/companies/built-with-bitcoin-foundation_4d52446b90e7d8d643b3874a5dc7fb31.jpg,,,,,,,,1.2,2,"Building communities around the world, one Bitcoin at a time. We are a humanitarian organization devoted to creating equitable opportunity by providing clean water, access to quality education,...",https://s3.cryptwerk.com/companies/built-with-bitcoin-foundation_4d52446b90e7d8d643b3874a5dc7fb31.jpg,,,,,,,,,,,,,,,
16756,41.0748591,-85.18221,"3234 Illinois Rd, Fort Wayne, IN, United States, 46802",https://click.cryptwerk.com/company-website/16756/,15448,Metallic Dice Games,metallic-dice-games,30.77,27,9,9,gaming,For gamers,,,,,,s3:///prod/companies/metallic-dice-games_1620eab5a66533c8f275336817805676.jpg,,,,,,,,1.5,2,"Metallic Dice Games is your source for the highest quality dice sets! Established in 2014, we originally carried Metal Dice sets and have since expanded our store to include Gemstone, Acrylic, and...",https://s3.cryptwerk.com/companies/metallic-dice-games_1620eab5a66533c8f275336817805676.jpg,,,,,,,,,,,,,,,
16760,41.8839927,-87.6197056,"Chicago, IL, United States, 60601",https://click.cryptwerk.com/company-website/16760/,15452,Guardian Custodian Cleaning Service,guardian-custodian-cleaning-service,30.77,172,160,160,home-and-garden,Home and garden,,,,,,s3:///prod/companies/guardian-custodian-cleaning-service_f0d69b1454e1f20333040eb80017f818.jpg,,,,,,,,1.5,2,"Guardian Cleaning Services completed 30 years of training and skill-building with the Easy Way Janitorial company. Our focus continues on the scope of Building Cleaning, Office Cleaning, and Home...",https://s3.cryptwerk.com/companies/guardian-custodian-cleaning-service_f0d69b1454e1f20333040eb80017f818.jpg,,,,,,,,,,,,,,,
16775,40.6460627,-74.0244993,"Brooklyn Army Terminal, 140a 58th St, Suite 6N, Brooklyn, NY, United States, 11220",https://click.cryptwerk.com/company-website/16775/,15467,JomaShop,jomashop,88.46,127,9,9,clothing,"Clothing, fashion",98,9,9,internet-shops,Different stores,s3:///prod/companies/jomashop_9a1a43bfefed062633835f5570cc629c.jpg,,1152,FRESH SALE,https://s3.cryptwerk.com/discounts/8803f1855395e214db4aa779cea0e231.jpg,0,Always fresh sales,,4.4,5,"Jomashop.com offers the best prices on watches, handbags, sunglasses, apparel, beauty, shoes, pens, and more with fast shipping and top-rated customer service. Our site features a huge selection...",https://s3.cryptwerk.com/companies/jomashop_9a1a43bfefed062633835f5570cc629c.jpg,230,9,9,gifts,Gifts,,,,,,,,,,
16775,40.6460627,-74.0244993,"Brooklyn Army Terminal, 140a 58th St, Suite 6N, Brooklyn, NY, United States, 11220",https://click.cryptwerk.com/company-website/16775/,15467,JomaShop,jomashop,88.46,127,9,9,clothing,"Clothing, fashion",98,9,9,internet-shops,Different stores,s3:///prod/companies/jomashop_9a1a43bfefed062633835f5570cc629c.jpg,,1153,Special offers,https://s3.cryptwerk.com/discounts/a56150c24cd22b563e9ceb8b7d89997c.jpg,0,Fresh special offers everyday,,4.4,5,"Jomashop.com offers the best prices on watches, handbags, sunglasses, apparel, beauty, shoes, pens, and more with fast shipping and top-rated customer service. Our site features a huge selection...",https://s3.cryptwerk.com/companies/jomashop_9a1a43bfefed062633835f5570cc629c.jpg,230,9,9,gifts,Gifts,,,,,,,,,,
16790,40.7040662,-74.0111456,"85 Broad St, New York, NY, United States, 10004",https://click.cryptwerk.com/company-website/16790/,15482,AlgoCap,algocap,30.77,195,160,160,real-estate,Real estate,,,,,,s3:///prod/companies/algocap_8354536257e2351b2b6b1a7dd014abdb.jpg,,,,,,,,1.5,2,AlgoCap is the first full-service brokerage house in New York City to enable real estate transactions using cryptocurrency. We find amazing apartments with fantastic views and facilitate the...,https://s3.cryptwerk.com/companies/algocap_8354536257e2351b2b6b1a7dd014abdb.jpg,,,,,,,,,,,,,,,
16797,32.7952528,-79.9427917,"6100 Wallace Becknell Rd, Santa Cafe, restaurants, barsCafe, restaurants, barsa, CA, United States, 93117",https://click.cryptwerk.com/company-website/16797/,15489,Direct Relief,direct-relief,38.46,242,113,113,charity-organization,Charity organization,,,,,,s3:///prod/companies/direct-relief_fd48e0f7ff62102386d0c025a3659511.jpg,,,,,,,,1.9,2,"Direct Relief is a nonprofit, apolitical, nonsectarian organization that provides humanitarian assistance without regard to race, ethnicity, political or religious affiliation, gender, or ability...",https://s3.cryptwerk.com/companies/direct-relief_fd48e0f7ff62102386d0c025a3659511.jpg,,,,,,,,,,,,,,,
16813,33.8324618,-84.3675331,"2847 Piedmont Rd NE, Atlanta, GA, United States, 30305",https://click.cryptwerk.com/company-website/16813/,15505,Buckhead Christian Ministry,buckhead-christian-ministry,26.92,242,113,113,charity-organization,Charity organization,,,,,,s3:///prod/companies/buckhead-christian-ministry_c45091650277eb9c65aebc71b0ac54eb.jpg,,,,,,,,1.3,2,"Each day, Buckhead Christian Ministry (BCM) intervenes in the lives of individuals and families in crisis. Through our longer-term programs, BCM provides supportive housing, financial education,...",https://s3.cryptwerk.com/companies/buckhead-christian-ministry_c45091650277eb9c65aebc71b0ac54eb.jpg,,,,,,,,,,,,,,,
16815,33.9202417,-118.3340067,"3501 Jack Northrop Ave, Box #E7777, Hawthorne, CA, United States, 90250",https://click.cryptwerk.com/company-website/16815/,15507,BilsteinLifts,bilsteinlifts,26.92,135,9,9,auto,"Auto, bikes, vehicles",,,,,,s3:///prod/companies/bilsteinlifts_ea2142b7ce4c260a9ba8784fc64ce7bb.jpg,,,,,,,,1.3,2,"We are an online store that sells suspension parts, lift kits, shocks and other automotive parts at affordable prices and fast shipping. We carry the following brands: ToyTec Lifts, ICON Vehicle...",https://s3.cryptwerk.com/companies/bilsteinlifts_ea2142b7ce4c260a9ba8784fc64ce7bb.jpg,,,,,,,,,,,,,,,
16817,40.0124652,-75.2137202,"111 Presidential Blvd, Bala Cynwyd, PA, United States, 19004",https://click.cryptwerk.com/company-website/16817/,15509,Alexs Lemonade Stand Foundation,alexs-lemonade-stand-foundation,34.62,242,113,113,charity-organization,Charity organization,,,,,,s3:///prod/companies/alexs-lemonade-stand-foundation_8ef3d82e82409aacd74446dd9c962948.jpg,,,,,,,,1.7,2,"Alexs Lemonade Stand Foundation (ALSF) emerged from the front yard lemonade stand of 4-year-old Alexandra “Alex” Scott, who was fighting cancer and wanted to raise money to find cures for all...",https://s3.cryptwerk.com/companies/alexs-lemonade-stand-foundation_8ef3d82e82409aacd74446dd9c962948.jpg,,,,,,,,,,,,,,,
16827,37.7910081,-122.4033221,"350 Bush St, SF, CA, United States, 94104",https://click.cryptwerk.com/company-website/16827/,15519,Twitch,twitch,23.08,246,22,22,streaming,Streaming,,,,,,s3:///prod/companies/twitch_4c0ecd7c6eb4b06e6217cc59188464c4.jpg,,,,,,,,1.2,2,"Launched in 2011, Twitch is a one-of-a-kind collision of subcultures, games, communities, and streamers co-creating content around everything they’re into.  This is more than just watching, this...",https://s3.cryptwerk.com/companies/twitch_4c0ecd7c6eb4b06e6217cc59188464c4.jpg,,,,,,,,,,,,,,,
16835,42.5254649,-88.6028695,"445 S Main St, Walworth, WI, United States, 53184",https://click.cryptwerk.com/company-website/16835/,15527,Mecum Auctions,mecum-auctions,34.62,243,160,160,auction-house,Auction house,,,,,,s3:///prod/companies/mecum-auctions_08ffc34c1fa6dff16bab350cfec2f3bd.jpg,,,,,,,,1.7,2,"Nobody sells more than Mecum. Nobody. The Mecum Auction Company is the world leader of collector car, vintage and antique motorcycle, and Road Art sales, hosting auctions throughout the United...",https://s3.cryptwerk.com/companies/mecum-auctions_08ffc34c1fa6dff16bab350cfec2f3bd.jpg,,,,,,,,,,,,,,,
16838,33.9983855,-118.4807214,"171 Pier Ave, Santa Monica, CA, United States, 90405",https://click.cryptwerk.com/company-website/16838/,15530,Dolphin Project,dolphin-project,26.92,242,113,113,charity-organization,Charity organization,,,,,,s3:///prod/companies/dolphin-project_5d8f3ca7f1669219288f7636b8c94372.jpg,,,,,,,,1.3,2,"Dolphin Project is a non-profit charitable organization, dedicated to the welfare and protection of dolphins worldwide. Founded by Richard (Ric) O’Cafe, restaurants, barsry on Earth Day, April...",https://s3.cryptwerk.com/companies/dolphin-project_5d8f3ca7f1669219288f7636b8c94372.jpg,,,,,,,,,,,,,,,
7515,44.903699,-72.404481,1176 bear mountain road N.Troy VT 05859,https://click.cryptwerk.com/company-website/7515/,6910,BannersRock,bannersrock,38.46,101,22,22,advertising,Ads,90,22,22,web-services,Services,s3:///prod/companies/bannersrock_7be5e4202cac6fd214b202dd54164560.jpg,,,,,,,,1.9,2,Low Cost Banner Advertising on Multiple Sites,https://s3.cryptwerk.com/companies/bannersrock_7be5e4202cac6fd214b202dd54164560.jpg,218,215,215,web-ad,Advertising,,,,,,,,,,
16868,36.3728728,-94.102411,997 Happy Trails Dr,https://click.cryptwerk.com/company-website/16868/,15560,Glossy Floors,glossy-floors,53.85,237,160,160,construction,Construction,172,160,160,home-and-garden,Home and garden,s3:///prod/companies/glossy-floors_20bfdbc204bf701afcc99b5d2ea236d7.jpg,,,,,,,,2.7,3,We've Got You Covered!,https://s3.cryptwerk.com/companies/glossy-floors_20bfdbc204bf701afcc99b5d2ea236d7.jpg,,,,,,,,,,,,,,,
7676,33.4522814,-117.5958865,"1009 Calle Sombra, San Clemente, California, USA",https://click.cryptwerk.com/company-website/7676/,7071,NDCHost,ndchost,65.38,120,22,22,cloud,Cloud,26,22,22,hosting,Hosting,s3:///prod/companies/ndchost_25d11b7d6e40e54ada7666a600ed3e72.jpg,,,,,,,,3.3,4,Web Hosting Provider,https://s3.cryptwerk.com/companies/ndchost_25d11b7d6e40e54ada7666a600ed3e72.jpg,,,,,,,,,,,,,,,
16873,36.7769134,-76.5704336,100 Carriage House Dr,https://click.cryptwerk.com/company-website/16873/,15565,Yokocutz,yokocutz,34.62,231,160,160,beauty-saloons,Beauty saloons,,,,,,s3:///prod/companies/yokocutz_be3c57545e27e719dd0ee39ca86f3e27.jpg,,,,,,,,1.7,2,A Barber who accepts Dogecoin,https://s3.cryptwerk.com/companies/yokocutz_be3c57545e27e719dd0ee39ca86f3e27.jpg,,,,,,,,,,,,,,,
16882,42.4466902,-83.2846319,"21133 Bridge Street, Southfield MI 48033",https://click.cryptwerk.com/company-website/16882/,15574,ENDOCORP,endocorp,71.15,170,160,160,medicine,Medicine,236,113,113,manufactures,Manufactures,s3:///prod/companies/endocorp_63b1850838956feb83ef3226ab4ec87e.jpg,,,,,,,,3.6,4,"We don't sell parts, we sell part solutions™",https://s3.cryptwerk.com/companies/endocorp_63b1850838956feb83ef3226ab4ec87e.jpg,,,,,,,,,,,,,,,
16909,36.778261,-119.4179324,CALIFORNIA,https://click.cryptwerk.com/company-website/16909/,15601,ProstSMM,prost-smm,67.31,90,22,22,web-services,Services,219,215,215,social-media-services,SMM,s3:///prod/companies/prost-smm_a32bfd54274c64bbea04d0be0ea2ddc4.jpg,,838,5% bonus,https://s3.cryptwerk.com/discounts/076975f55c60b4e777a2fb3e0d28cb0b.jpg,0,Deposit funds with crypto and get 5% bonus,,3.4,4,Prostsmm.com Cheapest HQ TikTok Youtube Instagram 5% Bonus,https://s3.cryptwerk.com/companies/prost-smm_a32bfd54274c64bbea04d0be0ea2ddc4.jpg,,,,,,,,,,,,,,,
17008,43.0186858,-74.0315162,"Galway, us",https://click.cryptwerk.com/company-website/17008/,15700,Cheap Panel,cheap-panel,46.15,216,215,215,seo,SEO,219,215,215,social-media-services,SMM,s3:///prod/companies/cheap-panel_ee625daa1de19f33ef0859f47c274c85.jpg,,837,5% bonus with crypto payments,https://s3.cryptwerk.com/discounts/f98071a1d7284c9007d573162178256b.jpg,0,Deposit $100+ with crypto and get 5% bonus,,2.3,3,Worlds cheapest   Cheapeast Wholesale SMM  Provider Panel since 2013,https://s3.cryptwerk.com/companies/cheap-panel_ee625daa1de19f33ef0859f47c274c85.jpg,,,,,,,,,,,,,,,
17012,33.3105561,-85.7527052,"88924 AL-9, Lineville, AL 36266, USA",,15704,Wizard Brixton Group of Hackers,wizard-brixton-group-of-hackers,26.92,190,22,22,security,Security,188,160,160,it,IT,s3:///prod/companies/wizard-brixton-group-of-hackers_20734261603ece0f8ea2f7f5ac9fb83e.jpg,,,,,,,,1.3,2,"I fully recommend you to contact us we will help you recovered all data I had on a lost phone and helped in tracking the phone till it was found, contact us ( Wizardbrixton@gmail.com)  WhatsApp :...",https://s3.cryptwerk.com/companies/wizard-brixton-group-of-hackers_20734261603ece0f8ea2f7f5ac9fb83e.jpg,,,,,,,,,,,,,,,
16954,33.8367588,-117.9516747,"1950 W Corporate Way, Apt #10624 Anaheim, CA 92801",https://click.cryptwerk.com/company-website/16954/,15646,Digital Fix Asset,digital-fix-asset,30.77,200,11,11,trading,Trading,,,,,,s3:///prod/companies/digital-fix-asset_d8e9a7e5a5c4fda87a228a0d447744f0.jpg,,,,,,,,1.5,2,Join the best live crypto trading signals group!,https://s3.cryptwerk.com/companies/digital-fix-asset_d8e9a7e5a5c4fda87a228a0d447744f0.jpg,,,,,,,,,,,,,,,
16998,45.5670977,-73.6033773,"3737 Boul Crémazie E, Montréal, QC H1Z 2K4",https://click.cryptwerk.com/company-website/16998/,15690,Vipera,vipera,61.54,119,9,9,mining-shops,Mining hardware,,,,,,s3:///prod/companies/vipera_45b815312ab75926307a055f8bd46170.jpg,,,,,,,,3.1,4,Top ASIC miners in stock. Explore your investment into the future.,https://s3.cryptwerk.com/companies/vipera_45b815312ab75926307a055f8bd46170.jpg,,,,,,,,,,,,,,,
15068,37.6509253,-121.8786518,5424 Sunol Blvd Ste 10-545,https://click.cryptwerk.com/company-website/15068/,13758,Sunshine Soul LLC,sunshine-soul-llc,88.46,230,9,9,gifts,Gifts,163,9,9,home-garden,"Home, garden",s3:///prod/companies/sunshine-soul-llc_a33935896aec92126c1719b812f615ef.jpg,,593,DOGE Discount,https://s3.cryptwerk.com/discounts/d164411cc946578ecaa2239b2fbda46a.jpg,10,"In the spirit of encouraging innovation and building a digital community, Sunshine Soul is offering a 10% discount for ALL DOGEcoin payments.",,4.4,5,Sunshine Soul is a lifestyle brand. We curate homemade candles that give life and light to you and your home.,https://s3.cryptwerk.com/companies/sunshine-soul-llc_a33935896aec92126c1719b812f615ef.jpg,,,,,,,,,,,,,,,
15068,37.6509253,-121.8786518,5424 Sunol Blvd Ste 10-545,https://click.cryptwerk.com/company-website/15068/,13758,Sunshine Soul LLC,sunshine-soul-llc,88.46,230,9,9,gifts,Gifts,163,9,9,home-garden,"Home, garden",s3:///prod/companies/sunshine-soul-llc_a33935896aec92126c1719b812f615ef.jpg,,594,BTC/ETH/LTC Discount,https://s3.cryptwerk.com/discounts/9295263d968b2b8a83a1373b602cb419.jpg,10,"In the spirit of encouraging innovation and building a digital community, Sunshine Soul is offering a 10% discount for ALL BTC/ETH/LTC payments.",,4.4,5,Sunshine Soul is a lifestyle brand. We curate homemade candles that give life and light to you and your home.,https://s3.cryptwerk.com/companies/sunshine-soul-llc_a33935896aec92126c1719b812f615ef.jpg,,,,,,,,,,,,,,,
15068,37.6509253,-121.8786518,5424 Sunol Blvd Ste 10-545,https://click.cryptwerk.com/company-website/15068/,13758,Sunshine Soul LLC,sunshine-soul-llc,88.46,230,9,9,gifts,Gifts,163,9,9,home-garden,"Home, garden",s3:///prod/companies/sunshine-soul-llc_a33935896aec92126c1719b812f615ef.jpg,,595,BNB Coin Discount,https://s3.cryptwerk.com/discounts/d9f6b9fb7e198867d022fa3a44772d02.jpg,10,"In the spirit of encouraging innovation and building a digital community, Sunshine Soul is offering a 10% discount for ALL BNB payments.",,4.4,5,Sunshine Soul is a lifestyle brand. We curate homemade candles that give life and light to you and your home.,https://s3.cryptwerk.com/companies/sunshine-soul-llc_a33935896aec92126c1719b812f615ef.jpg,,,,,,,,,,,,,,,
17062,37.702835,-89.216776,"1740 Innovation Dr. Suite # 210 Carbondale, IL. 62903",https://click.cryptwerk.com/company-website/17062/,15754,OptimusFox,optimusfox,73.08,207,113,113,blockchain,Blockchain,209,113,113,software-development,Software development,s3:///prod/companies/optimusfox_186e60916c5c7ce64dfa8cf4a27cf674.jpg,,,,,,,,3.7,4,Top Blockchain Development Company,https://s3.cryptwerk.com/companies/optimusfox_186e60916c5c7ce64dfa8cf4a27cf674.jpg,,,,,,,,,,,,,,,
16983,38.845055,-94.7730623,No adress,https://click.cryptwerk.com/company-website/16983/,15675,RedditBoost,redditboost,46.15,114,113,113,marketing-ads-pr,"Marketing, Ads, PR",218,215,215,web-ad,Advertising,s3:///prod/companies/redditboost_c2009e0ba4c31ba366d91c85447e7be4.jpg,,,,,,,,2.3,3,Cheapest Reddit Service Provider,https://s3.cryptwerk.com/companies/redditboost_c2009e0ba4c31ba366d91c85447e7be4.jpg,,,,,,,,,,,,,,,
17072,40.0010346,-75.11995,"3437 D Street, Suite 209, Philadelphia, PA 19134",https://click.cryptwerk.com/company-website/17072/,15764,Jaxcom,jaxcom,73.08,121,22,22,voip,VoIP,240,22,22,virtual-number,Virtual number,s3:///prod/companies/jaxcom_ae14bb4b2d8f22ac1f379121b28df5b1.jpg,26,,,,,,,3.7,4,Feature-packed VOIP phone system that helps scale your business.,https://s3.cryptwerk.com/companies/jaxcom_ae14bb4b2d8f22ac1f379121b28df5b1.jpg,191,113,113,it-services,IT services,,,,,,,,,,
986,37.6437906,-98.7544621,323 Illinois Ave Pratt KS 67124 USA,https://click.cryptwerk.com/company-website/986/,970,Directvoltage,directvoltage,88.46,109,9,9,computers,Electronics,239,9,9,household-appliance,Household appliance,s3:///prod/companies/directvoltage_76cdccac146f203bd72fe79702538dc6.jpg,,56,Register and get 10% off coupon,https://s3.cryptwerk.com/discounts/e0f415043aa81bafaead2b7105c2f256.jpg,10,"Sign up today and you will be able to :
- Receive 10% off coupon!
- Speed your way through checkout
- Track your orders easily
- Keep a record of all your purchases
- Earn valuable bonus points",,4.4,5,"DirectVoltage.com Electronics products, kits and services for hobbiest. From student makers to Engineers. Arduino, PCB Assembly, CNC milling, 3D printing, Lasers.",https://s3.cryptwerk.com/companies/directvoltage_76cdccac146f203bd72fe79702538dc6.jpg,,,,,,,,,,,,,,,
986,37.6437906,-98.7544621,323 Illinois Ave Pratt KS 67124 USA,https://click.cryptwerk.com/company-website/986/,970,Directvoltage,directvoltage,88.46,109,9,9,computers,Electronics,239,9,9,household-appliance,Household appliance,s3:///prod/companies/directvoltage_76cdccac146f203bd72fe79702538dc6.jpg,,291,Deals and Specials page,https://s3.cryptwerk.com/discounts/2153c0de5da0f4a20000ed31a3892170.jpg,0,Collection of products with special prices,,4.4,5,"DirectVoltage.com Electronics products, kits and services for hobbiest. From student makers to Engineers. Arduino, PCB Assembly, CNC milling, 3D printing, Lasers.",https://s3.cryptwerk.com/companies/directvoltage_76cdccac146f203bd72fe79702538dc6.jpg,,,,,,,,,,,,,,,
986,37.6437906,-98.7544621,323 Illinois Ave Pratt KS 67124 USA,https://click.cryptwerk.com/company-website/986/,970,Directvoltage,directvoltage,88.46,109,9,9,computers,Electronics,239,9,9,household-appliance,Household appliance,s3:///prod/companies/directvoltage_76cdccac146f203bd72fe79702538dc6.jpg,,448,"Refer your friends, get 10% off all products!",https://s3.cryptwerk.com/discounts/5362b673729131147aef786eef48b8aa.jpg,10,"Give your friends 10% Off All Products. When your friends buy from your invite link, you get 10% off all products!",,4.4,5,"DirectVoltage.com Electronics products, kits and services for hobbiest. From student makers to Engineers. Arduino, PCB Assembly, CNC milling, 3D printing, Lasers.",https://s3.cryptwerk.com/companies/directvoltage_76cdccac146f203bd72fe79702538dc6.jpg,,,,,,,,,,,,,,,
8209,39.730982,-75.6278893,"3422 Old Capitol Trail PMB# 989, Wilmington DE 19808",https://click.cryptwerk.com/company-website/8209/,7603,PaxFul,paxful-com,46.15,16,11,11,buy-sell-cryptocurrencies,Fast Exchanges,13,11,11,exchanges,Spot Exchanges,s3:///prod/companies/paxful-com_118023d1ffe6a846f4034725ed2bdb21.jpg,,,,,,,,2.3,3,Buy and Sell Cryptocurrency Instantly,https://s3.cryptwerk.com/companies/paxful-com_118023d1ffe6a846f4034725ed2bdb21.jpg,,,,,,,,,,,,,,,
17109,36.386646,-85.5453869,3194 York Hwy,https://click.cryptwerk.com/company-website/17109/,15801,The Twin Sagez,the-twin-sagez_1,30.77,90,22,22,web-services,Services,,,,,,s3:///prod/companies/the-twin-sagez_1_c39dd9c2c4603d38133b85ffc14a38ee.jpg,,,,,,,,1.5,2,Proofreading for 1 Dogecoin,https://s3.cryptwerk.com/companies/the-twin-sagez_1_c39dd9c2c4603d38133b85ffc14a38ee.jpg,,,,,,,,,,,,,,,
17110,34.058518,-118.442934,"10880 Wilshire Blvd., Suite 1101, Los Angeles, CA 90024",https://click.cryptwerk.com/company-website/17110/,15802,Pinnacle Quant,pinnacle-quant,65.38,200,11,11,trading,Trading,189,113,113,finance,Finance,s3:///prod/companies/pinnacle-quant_e8b430d5b8ea78473e6db866a3283ffa.jpg,,,,,,,,3.3,4,"Automated Trading System for Crypto, Futures, Forex, and Stocks.",https://s3.cryptwerk.com/companies/pinnacle-quant_e8b430d5b8ea78473e6db866a3283ffa.jpg,,,,,,,,,,,,,,,
