address_id,lat,lng,address,website,id,title,url,rating,categories.0.id,categories.0.parent_id,categories.0.root,categories.0.url,categories.0.title,categories.1.id,categories.1.parent_id,categories.1.root,categories.1.url,categories.1.title,image_url,premium,discount_id,discount_title,discount_image_url,discount_discount,discount_text,rating_stars,rating_number,rating_color,description,logo,categories.2.id,categories.2.parent_id,categories.2.root,categories.2.url,categories.2.title,categories.3.id,categories.3.parent_id,categories.3.root,categories.3.url,categories.3.title,categories.4.id,categories.4.parent_id,categories.4.root,categories.4.url,categories.4.title
6779,43.1647946,-78.693784,"168 Cottage St, Lockport, NY 14094, USA",https://click.cryptwerk.com/company-website/6779/,6174,Vjloops.com,vjloops-com,57.69,98,9,9,internet-shops,Different stores,126,9,9,music,Music,s3:///prod/companies/vjloops-com_2437bf0feca5df9b348e4168cc553ebd.jpg,,,,,,,,2.9,3,"The worlds largest VJ Loops shop for high quality royalty free motion backgrounds stock footage downloads in 4K, UHD, HD 1080p, 720p & Ultra Wide formats.",https://s3.cryptwerk.com/companies/vjloops-com_2437bf0feca5df9b348e4168cc553ebd.jpg,,,,,,,,,,,,,,,
6993,47.391277,-122.2485824,"23414 68th Ave S, Kent, WA 98032, USA",https://click.cryptwerk.com/company-website/6993/,6388,Opensourcesteel.com,opensourcesteel-com,53.85,98,9,9,internet-shops,Different stores,,,,,,s3:///prod/companies/opensourcesteel-com_9a13453cd752d67e482bccff3cc4b60d.jpg,,,,,,,,2.7,3,Open Source Steel is a high quality modular stainless supply company,https://s3.cryptwerk.com/companies/opensourcesteel-com_9a13453cd752d67e482bccff3cc4b60d.jpg,,,,,,,,,,,,,,,
6744,32.9754859,-96.8853773,"PO Box 112861, 75011, Carrollton, Dallas, Texas, USA",https://click.cryptwerk.com/company-website/6744/,6139,Vaporstation.com,vaporstation-com,53.85,164,9,9,smoking,Smoking,,,,,,s3:///prod/companies/vaporstation-com_59b1dd18e6f390e9de0801572a914c88.jpg,,,,,,,,2.7,3,"Welcome to the one of the best E-Cigarette Shop of US! Buy e-cigarettes & e-liquid online from The Vapor Station, The Vapor Station now accepts Bitcoin as a payment option, Shop with the...",https://s3.cryptwerk.com/companies/vaporstation-com_59b1dd18e6f390e9de0801572a914c88.jpg,,,,,,,,,,,,,,,
4277,39.93768,-75.165247,"2025 Washington Ave, Philadelphia, PA 19146, US",https://click.cryptwerk.com/company-website/4277/,4071,Pirate Printing Company,pirate-printing-company,50,98,9,9,internet-shops,Different stores,161,160,160,printing,Printing,s3:///prod/companies/pirate-printing-company_b24c1b6af87f9f0cfc913392ec731140.jpg,,,,,,,,2.5,3,"The Pirate Printing Company's in South Philly, the city of brotherly love! We sell Bitcoin, Silk Road, Snowden, and Copyleft T-Shirts. Bitcoin accepted!",https://s3.cryptwerk.com/companies/pirate-printing-company_b24c1b6af87f9f0cfc913392ec731140.jpg,,,,,,,,,,,,,,,
4096,40.75956,-73.830171,"65 W. Main St, Bergenfield, NY 07621, US",https://click.cryptwerk.com/company-website/4096/,3941,Jeffersons Apparel & Accessories,jeffersons-apparel-accessories,50,127,9,9,clothing,"Clothing, fashion",,,,,,s3:///prod/companies/jeffersons-apparel-accessories_58de35fc1dab3e78d86a782b12e65cd5.jpg,,,,,,,,2.5,3,Jeffersons Apparel & Accessories,https://s3.cryptwerk.com/companies/jeffersons-apparel-accessories_58de35fc1dab3e78d86a782b12e65cd5.jpg,,,,,,,,,,,,,,,
6951,37.97362,-122.5300614,"1224 4th St, San Rafael, CA 94901, USA",https://click.cryptwerk.com/company-website/6951/,6346,Essential Sleep Boutique,essentialsleepboutique-com,50,163,9,9,home-garden,"Home, garden",,,,,,s3:///prod/companies/essentialsleepboutique-com_87b8d96aa5d985f5538c0f9f5cd638b2.jpg,,,,,,,,2.5,3,"Largest Selection of Natural & Organic Latex, Memory Foam, and Coil Mattresses in the area. Adjustable Beds, Pillows, Toppers, Sheets, Comforters and more.",https://s3.cryptwerk.com/companies/essentialsleepboutique-com_87b8d96aa5d985f5538c0f9f5cd638b2.jpg,,,,,,,,,,,,,,,
1822,37.09024,-95.712891,United States,https://click.cryptwerk.com/company-website/1822/,1805,Cryptoish,cryptoish,46.15,110,9,9,souvenirs,Souvenirs,,,,,,s3:///prod/companies/cryptoish_d4c229e2696d3d57c04393150b8d2f3c.jpg,,,,,,,,2.3,3,CRYPTOiSH was created with love for the crypto community by @MISSNATOSHI. Her vision was for all fellow hodlers to look good and have fun while spreading crypto awareness all over the world. We...,https://s3.cryptwerk.com/companies/cryptoish_d4c229e2696d3d57c04393150b8d2f3c.jpg,,,,,,,,,,,,,,,
2980,40.714627,-74.068134,100 Dudley St #2414 Jersey City NJ 07302 USA,https://click.cryptwerk.com/company-website/2980/,2964,Cointelegraph Store,cointelegraph-store,46.15,127,9,9,clothing,"Clothing, fashion",110,9,9,souvenirs,Souvenirs,s3:///prod/companies/cointelegraph-store_69b9f9ea19c8b7e92b86a7b815aed106.jpg,,,,,,,,2.3,3,"Crypto merch and gifts. Fine apparel for cryptocurrency fans. Get Bitcoin, Ethereum and other altcoins on your t-shirt, hoodie, sweatshirts in Cointelegraph Store",https://s3.cryptwerk.com/companies/cointelegraph-store_69b9f9ea19c8b7e92b86a7b815aed106.jpg,,,,,,,,,,,,,,,
1057,40.009399,-75.233788,"45 E City Avenue Suite 1645 Bala Cynwyd, PA 19004 USA",https://click.cryptwerk.com/company-website/1057/,1041,CBDregion.com,cbdregion-com,42.31,235,9,9,cbd-products,CBD products,144,9,9,health,Health,s3:///prod/companies/cbdregion-com_faa187867d9973f48697601662694d8f.jpg,,,,,,,,2.1,3,CBD Region offers a variety of pure CBD products derived from hemp containing less than 0.3% of THC!,https://s3.cryptwerk.com/companies/cbdregion-com_faa187867d9973f48697601662694d8f.jpg,206,9,9,pharmacy,Pharmacy,,,,,,,,,,
5131,32.62921,-114.874196,"6405 St Andrews Way, Whistler, BC V0N1B6, CA",https://click.cryptwerk.com/company-website/5131/,4714,Justine Brooks Jewelry Design,justine-brooks-jewelry-design,46.15,125,9,9,jewelry,Jewelries,,,,,,s3:///prod/companies/justine-brooks-jewelry-design_73b139eea1a9d323ace7faa5f0d08516.jpg,,,,,,,,2.3,3,"Welcome to Justine Brooks Designs! Justine is a Vancouver jewelry designer who creates accessories inspired by Nature, such as pinecone pendants, twig stacking rings, & anatomical heart locket....",https://s3.cryptwerk.com/companies/justine-brooks-jewelry-design_73b139eea1a9d323ace7faa5f0d08516.jpg,,,,,,,,,,,,,,,
6546,33.736256,-118.033184,"15559 Graham Street Huntington Beach, CA 92649, USA",https://click.cryptwerk.com/company-website/6546/,5941,Carrozzasurfboards.com,carrozzasurfboards-com,46.15,193,9,9,sport-stores,Sports,181,160,160,sport,Sport,s3:///prod/companies/carrozzasurfboards-com_98673e42202b75b7c4e99a7bf224999e.jpg,,,,,,,,2.3,3,Carrozza surfboards specializes in building high performance surfboards.,https://s3.cryptwerk.com/companies/carrozzasurfboards-com_98673e42202b75b7c4e99a7bf224999e.jpg,,,,,,,,,,,,,,,
1982,40.712775,-74.005973,"New York, USA",https://click.cryptwerk.com/company-website/1982/,1965,EyePatch Case,eyepatch-case,42.31,109,9,9,computers,Electronics,,,,,,s3:///prod/companies/eyepatch-case_85e452252f7b57fd8b7a0f65a93671c6.jpg,,,,,,,,2.1,3,EyePatch Case is THE phone case for camera protection and privacy! A unique phone case with a feature none other has; a sliding fabric-lined lens cap that wipes your lens clean every time you open...,https://s3.cryptwerk.com/companies/eyepatch-case_85e452252f7b57fd8b7a0f65a93671c6.jpg,,,,,,,,,,,,,,,
1969,45.501689,-73.567256,"Montreal, QC, Canada",https://click.cryptwerk.com/company-website/1969/,1952,CryptoShirt.io,cryptoshirt-io,42.31,127,9,9,clothing,"Clothing, fashion",110,9,9,souvenirs,Souvenirs,s3:///prod/companies/cryptoshirt-io_74707114574564806659d7a8c201b234.jpg,,,,,,,,2.1,3,"We are a Crypto Clothing company. We offer a wide range of t-shirts choice, from Bitcoin to Tezos, we got them all.",https://s3.cryptwerk.com/companies/cryptoshirt-io_74707114574564806659d7a8c201b234.jpg,,,,,,,,,,,,,,,
7148,37.792913,-122.422901,"2115 Van Ness Ave, San Francisco, CA 94109, USA",https://click.cryptwerk.com/company-website/7148/,6543,Oxbridgecoins.com,oxbridgecoins-com,38.46,226,9,9,precious-metals,Precious metals,,,,,,s3:///prod/companies/oxbridgecoins-com_3196ff649512cf82b849a9c823d1fb06.jpg,,,,,,,,1.9,2,"Gold Coins, Gold Bullion, Gold Bars, Oxbridge Coins",https://s3.cryptwerk.com/companies/oxbridgecoins-com_3196ff649512cf82b849a9c823d1fb06.jpg,,,,,,,,,,,,,,,
6743,44.931633,-85.192335,"7053 M-88 South, Bellaire, MI, 49615 - USA",https://click.cryptwerk.com/company-website/6743/,6138,Traversebayfarms.com,traversebayfarms-com,38.46,76,9,9,food,"Food, drinks",144,9,9,health,Health,s3:///prod/companies/traversebayfarms-com_3a87298c229936e361cede8491fb5c23.jpg,,,,,,,,1.9,2,"100% pure tart cherry juice concentrate, tart cherry capsules, tart cherry juice, Montmorency tart cherries and dried tart cherries.",https://s3.cryptwerk.com/companies/traversebayfarms-com_3a87298c229936e361cede8491fb5c23.jpg,,,,,,,,,,,,,,,
962,35.2937296,-120.6617137,"331 Hathway Ave   San Luis Obispo, Ca   93405",https://click.cryptwerk.com/company-website/962/,946,CrytoFocus.com,cryptofocus-com,34.62,119,9,9,mining-shops,Mining hardware,133,9,9,wallet-stores,Wallets store,s3:///prod/companies/cryptofocus-com_a12a1876f9e945715b4122f066b13fe4.jpg,,,,,,,,1.7,2,"We are Authorized Resellers of Nano Ledger S Hardware Wallets, Trezor Hardware Wallets, and Other Crypto Hardware.",https://s3.cryptwerk.com/companies/cryptofocus-com_a12a1876f9e945715b4122f066b13fe4.jpg,,,,,,,,,,,,,,,
5922,33.499422,-117.6537,"26146 Via Monterey, San Juan Capistrano, CA 92675, US",https://click.cryptwerk.com/company-website/5922/,5355,East West Hydro,east-west-hydro,34.62,208,9,9,growing,Growing plants,163,9,9,home-garden,"Home, garden",s3:///prod/companies/east-west-hydro_b13350fbb1ee9eae3dae54a932ad808c.jpg,,,,,,,,1.7,2,"EastWestHydro is a leading supplier of hydroponic components & systems, including: grow lights, grow tents, plant nutrients, hydroponics & control systems.",https://s3.cryptwerk.com/companies/east-west-hydro_b13350fbb1ee9eae3dae54a932ad808c.jpg,,,,,,,,,,,,,,,
6982,38.6859414,-121.1407554,"134 Windstar Cir, Folsom, CA 95630, USA",https://click.cryptwerk.com/company-website/6982/,6377,Dpcav.com,dpcav-com,34.62,109,9,9,computers,Electronics,,,,,,s3:///prod/companies/dpcav-com_40fac500db4caa3c60978644acd28d68.jpg,,,,,,,,1.7,2,"Digital Products Company has accessories for FPV, drones, sUAS, UAV, radio control, R/C, aerial photography, & more.",https://s3.cryptwerk.com/companies/dpcav-com_40fac500db4caa3c60978644acd28d68.jpg,,,,,,,,,,,,,,,
65,40.7233127,-73.9993783,"Spring Street New York, NY 10012",https://click.cryptwerk.com/company-website/65/,57,Fancy,fancy,26.92,23,9,9,marketplaces,Marketplaces,,,,,,s3:///prod/companies/fancy_094386e53c4d59e7d7972408f7d59410.jpg,,,,,,,,1.3,2,"Discover amazing stuff, collect the things you love, buy it all in one place.",https://s3.cryptwerk.com/companies/fancy_094386e53c4d59e7d7972408f7d59410.jpg,,,,,,,,,,,,,,,
7166,42.205097,-84.554187,"2880 Moscow Rd, Spring Arbor, MI 49283, USA",https://click.cryptwerk.com/company-website/7166/,6561,Nwradiosupply.com,nwradiosupply-com,23.08,109,9,9,computers,Electronics,176,160,160,electronics,Electronics,s3:///prod/companies/nwradiosupply-com_e9a81e6c7d25bea6536c1d48bb72758f.jpg,,,,,,,,1.2,2,Northwest Radio Supply - Amateur and commercial radios and supplies. Based out of Moscow Idaho we proudly serve the local community and regions EMS and Hams.,https://s3.cryptwerk.com/companies/nwradiosupply-com_e9a81e6c7d25bea6536c1d48bb72758f.jpg,,,,,,,,,,,,,,,
15116,34.1473283,-118.785081,"30495 Canwood St, Agoura Hills, CA 91301",https://click.cryptwerk.com/company-website/15116/,13806,Pay Later Tires,pay-later-tires,69.23,135,9,9,auto,"Auto, bikes, vehicles",174,160,160,cars-auto-service,"Cars, auto",s3:///prod/companies/pay-later-tires_fc067d4d77650d9c65a243dd2ce4a9ff.jpg,,613,5% off any set of 4 tires or wheels,https://s3.cryptwerk.com/discounts/f34d1d93278e7bae8b3fe2cf6c773f78.jpg,5,Lease 4 or more tires or wheels and get 5% off your order with this coupon code,,3.5,4,Purchase new tires or wheels online and have them delivered to your home or a licensed installer.,https://s3.cryptwerk.com/companies/pay-later-tires_fc067d4d77650d9c65a243dd2ce4a9ff.jpg,,,,,,,,,,,,,,,
719,39.6305889,-104.8968197,"London Trust Media, Inc.  4643 S Ulster Street, Suite 1120 Denver, CO 80237",https://click.cryptwerk.com/company-website/719/,706,Private Internet Access,privateinternetaccess-com,90.38,122,22,22,proxy,Proxy,102,22,22,vpn,VPN,s3:///prod/companies/privateinternetaccess-com_0c19ab9be75cbd5b544607125b7c7798.jpg,,41,+ 2 Months Free if you pay for 1 year,https://s3.cryptwerk.com/discounts/a6dbf215917f58823229588567455f0c.jpg,0,"Pay for 1 year service and get 2 months for free! You'll be billed at once at signup, and the free extra time is a one-time promotional offer.",,4.5,5,High-speed anonymous VPN Service from Private Internet Access. Protect yourself with our secure VPN tunnel. Packages starting at $2.91/mo. Register today.,https://s3.cryptwerk.com/companies/privateinternetaccess-com_0c19ab9be75cbd5b544607125b7c7798.jpg,,,,,,,,,,,,,,,
719,39.6305889,-104.8968197,"London Trust Media, Inc.  4643 S Ulster Street, Suite 1120 Denver, CO 80237",https://click.cryptwerk.com/company-website/719/,706,Private Internet Access,privateinternetaccess-com,90.38,122,22,22,proxy,Proxy,102,22,22,vpn,VPN,s3:///prod/companies/privateinternetaccess-com_0c19ab9be75cbd5b544607125b7c7798.jpg,,486,Holiday Season Sale,https://s3.cryptwerk.com/discounts/b55b5ea5b7eb7236234b2e4afa2dcbc1.jpg,81,Get Private Internet Access VPN for 81% Off,,4.5,5,High-speed anonymous VPN Service from Private Internet Access. Protect yourself with our secure VPN tunnel. Packages starting at $2.91/mo. Register today.,https://s3.cryptwerk.com/companies/privateinternetaccess-com_0c19ab9be75cbd5b544607125b7c7798.jpg,,,,,,,,,,,,,,,
1717,41.134468,-104.798072,"1910 Thomes Ave, Cheyenne, WY 82001",https://click.cryptwerk.com/company-website/1717/,1700,GiraffeCloud LLC,giraffecloud,65.38,66,22,22,domains,Domains,26,22,22,hosting,Hosting,s3:///prod/companies/giraffecloud_299878520d84a855d534a91e07c98522.jpg,,,,,,,,3.3,4,"GiraffeCloud LLC offer services: Web hosting with Windows or Linux and shared SSL in the United States and Europe, VPS in 15 locations, Domain, Certificate, SSL",https://s3.cryptwerk.com/companies/giraffecloud_299878520d84a855d534a91e07c98522.jpg,,,,,,,,,,,,,,,
216,43.698977,-80.3708237,710 Tower St South PO Box 50081  Fergus Ontario N1M 2R0 Canada,https://click.cryptwerk.com/company-website/216/,204,Hawkhost.com,hawkhost-com,61.54,26,22,22,hosting,Hosting,,,,,,s3:///prod/companies/hawkhost-com_8bb237cb1866575f95311c72601033d7.jpg,,,,,,,,3.1,4,"We offer high quality virtual web hosting, reseller hosting and VPS hosting all at an affordable price and with award winning 24/ 7 support!",https://s3.cryptwerk.com/companies/hawkhost-com_8bb237cb1866575f95311c72601033d7.jpg,,,,,,,,,,,,,,,
715,40.9298537,-74.0756332,"45 Eisenhower Dr. Suite 520, Paramus, NJ 07652",https://click.cryptwerk.com/company-website/715/,702,Proxykey.com,proxykey-com,65.38,122,22,22,proxy,Proxy,,,,,,s3:///prod/companies/proxykey-com_e66e7a08c80607432842d94fcd0b2cce.jpg,,,,,,,,3.3,4,Proxy Key is the global leader in private proxies. We offer a secure and reliable proxy solution in all 50 US states and over a dozen countries.,https://s3.cryptwerk.com/companies/proxykey-com_e66e7a08c80607432842d94fcd0b2cce.jpg,,,,,,,,,,,,,,,
15117,30.2982525,-82.2213514,Oyewole Road,https://click.cryptwerk.com/company-website/15117/,13807,HireJames,hirejames,63.46,66,22,22,domains,Domains,188,160,160,it,IT,s3:///prod/companies/hirejames_582beef8d820dee757a3c2ccbe7de936.jpg,,,,,,,,3.2,4,Business and Digital Services,https://s3.cryptwerk.com/companies/hirejames_582beef8d820dee757a3c2ccbe7de936.jpg,,,,,,,,,,,,,,,
15136,33.836607,-118.0624033,12624 Gradwell Street Lakewood CA 90715,https://click.cryptwerk.com/company-website/15136/,13826,Top Loader Sports,top-loader-sports,53.85,167,9,9,art,Art,98,9,9,internet-shops,Different stores,s3:///prod/companies/top-loader-sports_00fc0e52560b495c1cbfecd723f5d7fb.jpg,,614,10% off,https://s3.cryptwerk.com/discounts/e4f92aea40f483763a913c24f1a7a48b.jpg,10,10% OFF YOUR PURCHASE WITH PROMO CODE: HODL,,2.7,3,"Reliving our childhood, one card at a time.",https://s3.cryptwerk.com/companies/top-loader-sports_00fc0e52560b495c1cbfecd723f5d7fb.jpg,,,,,,,,,,,,,,,
6328,27.570611,-80.367436,"P.O. Box 1442 Palm City, Florida 34991",https://click.cryptwerk.com/company-website/6328/,5723,Glowhost,glowhost-com,88.46,66,22,22,domains,Domains,26,22,22,hosting,Hosting,s3:///prod/companies/glowhost-com_223847f2ca2a724a924bbc6e17456f14.jpg,,149,30% OFF,https://s3.cryptwerk.com/discounts/50a2949daeb67eacd8937361c7f65d3a.jpg,30,"30% OFF - Your First Invoice is 30% Off!
Use Coupon Code: 30OFFTODAY",,4.4,5,GlowHost just might be the best web hosting provider that you may have never heard of.,https://s3.cryptwerk.com/companies/glowhost-com_223847f2ca2a724a924bbc6e17456f14.jpg,,,,,,,,,,,,,,,
11821,33.8743884,-118.2819881,"17224 South Figueroa Street, Gardena, California, United States, 90248",https://click.cryptwerk.com/company-website/11821/,10568,Planet express,planet-express,61.54,145,22,22,different,Different,214,22,22,shopping,Shopping,s3:///prod/companies/planet-express_d4678fc68203cafc2778672be7eb4080.jpg,,,,,,,,3.1,4,SHOP IN THE USA – SHIP WORLDWIDE Get your own US Address and start shopping today to get the best deals! No sales tax!,https://s3.cryptwerk.com/companies/planet-express_d4678fc68203cafc2778672be7eb4080.jpg,,,,,,,,,,,,,,,
958,43.6536139,-79.3985676,"310 Spadina Ave, Suite 200 Toronto, Ontario, M5T 2E7",https://click.cryptwerk.com/company-website/958/,942,Tunnelbear.com,tunnelbear-com,51.92,102,22,22,vpn,VPN,,,,,,s3:///prod/companies/tunnelbear-com_bd9736a175b804b280bd2778c0916b0b.jpg,,,,,,,,2.6,3,"Really simple VPN to browse the web privately & securely. Unblock websites around the world with applications for Mac, PC, iOS, Android & your browser.",https://s3.cryptwerk.com/companies/tunnelbear-com_bd9736a175b804b280bd2778c0916b0b.jpg,,,,,,,,,,,,,,,
53,40.5293104,-111.8824764,"12180 South 300 East #502 Draper, Utah 84020 USA",https://click.cryptwerk.com/company-website/53/,45,Javapipe.com,javapipe-com,57.69,26,22,22,hosting,Hosting,,,,,,s3:///prod/companies/javapipe-com_2153ae797d2c9e8141c713711a246b73.jpg,,,,,,,,2.9,3,Business-grade Cloud web hosting for Java and PHP based websites and industry-leading DDoS protection solutions against cyber threats.,https://s3.cryptwerk.com/companies/javapipe-com_2153ae797d2c9e8141c713711a246b73.jpg,,,,,,,,,,,,,,,
199,33.4484047,-111.9837099,"4600 East Washington Street Suite 305, Phoenix, AZ 85034, USA",https://click.cryptwerk.com/company-website/199/,188,SSLs,ssls,57.69,111,22,22,ssl,SSL,,,,,,s3:///prod/companies/ssls_5d687f873090957a7b9b9655eabd8b1d.jpg,,,,,,,,2.9,3,"We’ve been running the SSL store officially since 2009 (some like to say it was 2004, but our footer says 2009, so there you go). We don’t like to brag, but 115K certificates have found their...",https://s3.cryptwerk.com/companies/ssls_5d687f873090957a7b9b9655eabd8b1d.jpg,,,,,,,,,,,,,,,
859,38.8244224,-94.5345827,"LLC 604 N Scott Avenue Belton, MO  64012",https://click.cryptwerk.com/company-website/859/,846,BillPayForCoins,billpayforcoins,53.85,131,22,22,bills,Bills,,,,,,s3:///prod/companies/billpayforcoins_7084105c961da592b0f47a2a8c6bc780.jpg,,,,,,,,2.7,3,Bill Pay For Coins,https://s3.cryptwerk.com/companies/billpayforcoins_7084105c961da592b0f47a2a8c6bc780.jpg,,,,,,,,,,,,,,,
46,40.7127753,-74.0059728,"US, New York Phone",https://click.cryptwerk.com/company-website/46/,39,AwardSpace,awardspace,46.15,66,22,22,domains,Domains,26,22,22,hosting,Hosting,s3:///prod/companies/awardspace_caf5edf1b85a8742627106a86e50fa43.jpg,,,,,,,,2.3,3,"AwardSpace is a free web hosting provider with NO ADS, paid web hosting, VPS hosting, reseller hosting, domain name registration and SSL certificates.",https://s3.cryptwerk.com/companies/awardspace_caf5edf1b85a8742627106a86e50fa43.jpg,,,,,,,,,,,,,,,
11165,34.1809325,-118.3308189,"1812 West Burbank Boulevard #663, Burbank, California, United States, 91504",https://click.cryptwerk.com/company-website/11165/,9919,ZeroStopBits,zerostopbits,30.77,26,22,22,hosting,Hosting,,,,,,s3:///prod/companies/zerostopbits_67932b1a895861c9636cb18e501cb750.jpg,,,,,,,,1.5,2,"We are a privately-held, Los Angeles based web hosting and server management provider. Our staff members have years of extensive knowledge in the field of server administration, networking...",https://s3.cryptwerk.com/companies/zerostopbits_67932b1a895861c9636cb18e501cb750.jpg,,,,,,,,,,,,,,,
44,42.8666803,-88.3334274,P.O. Box 663 Mukwonago WI 53149,https://click.cryptwerk.com/company-website/44/,38,MonsterMegs,monstermegs,92.31,66,22,22,domains,Domains,26,22,22,hosting,Hosting,s3:///prod/companies/monstermegs_7d2495f65dced1921f129ab3fa174915.jpg,,942,50% OFF Hosting Sale,https://s3.cryptwerk.com/discounts/8d8585854ef84853e842d18a49ccfe4c.jpg,50,Take 50% off any of our Hosting packages on a 1 or 2 year term.,,4.6,5,"MonsterMegs is a Wisconsin based provider of affordable and reliable web hosting for small to mid-sized businesses. MonsterMegs provides SSD Web hosting, Semi-Dedicated Hosting, and Reseller Hosting.",https://s3.cryptwerk.com/companies/monstermegs_7d2495f65dced1921f129ab3fa174915.jpg,,,,,,,,,,,,,,,
15226,32.8118293,-96.977562,2418 Helmet St,https://click.cryptwerk.com/company-website/15226/,13919,Mighty Max Cart LLC,mighty-max-cart-llc,76.92,98,9,9,internet-shops,Different stores,163,9,9,home-garden,"Home, garden",s3:///prod/companies/mighty-max-cart-llc_f471f3167f0990bdd5a805519c9aef51.jpg,,,,,,,,3.8,4,USA MADE Utility Carts,https://s3.cryptwerk.com/companies/mighty-max-cart-llc_f471f3167f0990bdd5a805519c9aef51.jpg,,,,,,,,,,,,,,,
15244,44.2005414,-78.9508881,"8 Coryell St, Seagrave, ON L0C 1G0",https://click.cryptwerk.com/company-website/15244/,13937,Illusive Moose Shop,illusive-moose-shop,38.46,109,9,9,computers,Electronics,230,9,9,gifts,Gifts,s3:///prod/companies/illusive-moose-shop_901e9cab0097cba2bb249b999b662b82.jpg,,,,,,,,1.9,2,Buy products from small Canadian businesses,https://s3.cryptwerk.com/companies/illusive-moose-shop_901e9cab0097cba2bb249b999b662b82.jpg,,,,,,,,,,,,,,,
15251,45.1310329,-93.2518594,8809 Quincy Street Northeast,https://click.cryptwerk.com/company-website/15251/,13944,Wendy the Harpist,wendy-the-harpist,38.46,177,160,160,entertainment,Entertainment,,,,,,s3:///prod/companies/wendy-the-harpist_fbb06d6d9b89271d89a46dbc501f72cd.jpg,,,,,,,,1.9,2,"Celtic, Renaissance and Classical Harpist for Your Event",https://s3.cryptwerk.com/companies/wendy-the-harpist_fbb06d6d9b89271d89a46dbc501f72cd.jpg,,,,,,,,,,,,,,,
15253,27.9162927,-82.8180801,"2840 West Bay Drive #310, Belleair Bluffs, FL 33770",https://click.cryptwerk.com/company-website/15253/,13946,"Real Deal Pearls, LLC",real-deal-pearls-llc,46.15,125,9,9,jewelry,Jewelries,,,,,,s3:///prod/companies/real-deal-pearls-llc_4ee12f47c960dcd1725b400eae7236d5.jpg,,,,,,,,2.3,3,Not your average pearl party!,https://s3.cryptwerk.com/companies/real-deal-pearls-llc_4ee12f47c960dcd1725b400eae7236d5.jpg,,,,,,,,,,,,,,,
15272,42.428069,-123.123139,1424 N. River rd. Gold Hill oregon 97525,https://click.cryptwerk.com/company-website/15272/,13965,Rogue Origin,rogue-origin,72.12,235,9,9,cbd-products,CBD products,208,9,9,growing,Growing plants,s3:///prod/companies/rogue-origin_37cea98d310bb596c3df0181debdc83f.jpg,,,,,,,,3.6,4,Smokeable cbd flower,https://s3.cryptwerk.com/companies/rogue-origin_37cea98d310bb596c3df0181debdc83f.jpg,,,,,,,,,,,,,,,
15245,43.64939,-79.667796,915 Meyerside Dr Mississagua ON l5T 1R8,https://click.cryptwerk.com/company-website/15245/,13938,Geeky Rings,geeky-rings,53.85,125,9,9,jewelry,Jewelries,226,9,9,precious-metals,Precious metals,s3:///prod/companies/geeky-rings_9f8efacc9105e0b28d2f76aa05eb2e8b.jpg,,,,,,,,2.7,3,Geeky Rings is a jewelry design and manufacturing studio.,https://s3.cryptwerk.com/companies/geeky-rings_9f8efacc9105e0b28d2f76aa05eb2e8b.jpg,,,,,,,,,,,,,,,
15312,29.71,-82.4,"P.O. Box 358701, Gainesville FL, 32635",https://click.cryptwerk.com/company-website/15312/,14005,Wacky Sauces LLC,wacky-sauces-llc,53.85,127,9,9,clothing,"Clothing, fashion",76,9,9,food,"Food, drinks",s3:///prod/companies/wacky-sauces-llc_96e2a1b6a87d85fa1c976904fe95dcc8.jpg,,,,,,,,2.7,3,We sell F@*king Hot Sauce and Merch! Accepting DOGE up to a $420.69 purchase.,https://s3.cryptwerk.com/companies/wacky-sauces-llc_96e2a1b6a87d85fa1c976904fe95dcc8.jpg,,,,,,,,,,,,,,,
15320,35.7675851,-84.1398653,"157 Disco Loop Rd, Friendsville TN 37737",https://click.cryptwerk.com/company-website/15320/,14013,"Produced by Deuce, LLC",produced-by-deuce-llc,50,161,160,160,printing,Printing,114,113,113,marketing-ads-pr,"Marketing, Ads, PR",s3:///prod/companies/produced-by-deuce-llc_7d9fc33f9d572fe7cd31065f9bfe594a.jpg,,,,,,,,2.5,3,We print. We Market . We Code,https://s3.cryptwerk.com/companies/produced-by-deuce-llc_7d9fc33f9d572fe7cd31065f9bfe594a.jpg,,,,,,,,,,,,,,,
15333,28.1303528,-80.5802942,109 CORAL WAY E APT B,https://click.cryptwerk.com/company-website/15333/,14026,Twisted Chrome Pinstripes,twisted-chrome-pinstripes,61.54,167,9,9,art,Art,135,9,9,auto,"Auto, bikes, vehicles",s3:///prod/companies/twisted-chrome-pinstripes_0844dbe9d022204dc29d8a04a78ac7df.jpg,,681,10% discount,https://s3.cryptwerk.com/discounts/c71e5adead536ce9bb80ec64cdc426b5.jpg,10,Get 10% off using coupon SAVE10,,3.1,4,"Vinyl Pinstripe Decals that looks like paint, over 20 years serving the hot rod and kustom kulture community",https://s3.cryptwerk.com/companies/twisted-chrome-pinstripes_0844dbe9d022204dc29d8a04a78ac7df.jpg,,,,,,,,,,,,,,,
