address_id,lat,lng,address,website,id,title,url,rating,categories.0.id,categories.0.parent_id,categories.0.root,categories.0.url,categories.0.title,categories.1.id,categories.1.parent_id,categories.1.root,categories.1.url,categories.1.title,image_url,premium,discount_id,discount_title,discount_image_url,discount_discount,discount_text,rating_stars,rating_number,rating_color,description,logo,categories.2.id,categories.2.parent_id,categories.2.root,categories.2.url,categories.2.title,categories.3.id,categories.3.parent_id,categories.3.root,categories.3.url,categories.3.title,categories.4.id,categories.4.parent_id,categories.4.root,categories.4.url,categories.4.title
10999,35.0785997,-106.4978637,"13600 Copper Ave Ne Ste C, Albuquerque, NM 87123 USA",https://click.cryptwerk.com/company-website/10999/,9753,FilamentOne.com,filamentone-com,61.54,109,9,9,computers,Electronics,161,160,160,printing,Printing,s3:///prod/companies/filamentone-com_6bb36a2ca67ed82d98182c3c11c216fa.jpg,,,,,,,,3.1,4,3D printing tools and supplies,https://s3.cryptwerk.com/companies/filamentone-com_6bb36a2ca67ed82d98182c3c11c216fa.jpg,,,,,,,,,,,,,,,
14948,45.472057,-73.440989,5369 Boulevard Milan app.E Brossard Canada J4Z 2A7,https://click.cryptwerk.com/company-website/14948/,13638,Calypso Eco Soap Factory,calypso-eco-soap-factory,69.23,201,9,9,beauty,Beauty,83,9,9,giftcards,GiftCards,s3:///prod/companies/calypso-eco-soap-factory_b3e137bd174560345cb5943964c8bd69.jpg,,706,calypso products,https://s3.cryptwerk.com/discounts/b76f9762dbaf42dc60a89f72584ee837.jpg,10,10% additionnal on all products,,3.5,4,ecofriendly zero waste entreprise who locally produced organic cosmetics and supply ecological accessories,https://s3.cryptwerk.com/companies/calypso-eco-soap-factory_b3e137bd174560345cb5943964c8bd69.jpg,,,,,,,,,,,,,,,
6437,36.952915,-99.115868,United States,https://click.cryptwerk.com/company-website/6437/,5832,The Value Hosted,the-value-hosted-pvt-ltd,71.15,26,22,22,hosting,Hosting,90,22,22,web-services,Services,s3:///prod/companies/the-value-hosted-pvt-ltd_05d90832d66e16a3c4ffc1c5f63a8776.jpg,,313,Get 10% OFF on All Web Hosting Plans for LIFETIME,https://s3.cryptwerk.com/discounts/41f093cb8451f0c5b5974d81f8b22be5.jpg,10,Use Promo Code: D6MGMC6K1P and Get 10% OFF on All Web Hosting Plans for LIFETIME.,,3.6,4,Web Hosting Company,https://s3.cryptwerk.com/companies/the-value-hosted-pvt-ltd_05d90832d66e16a3c4ffc1c5f63a8776.jpg,,,,,,,,,,,,,,,
6437,36.952915,-99.115868,United States,https://click.cryptwerk.com/company-website/6437/,5832,The Value Hosted,the-value-hosted-pvt-ltd,71.15,26,22,22,hosting,Hosting,90,22,22,web-services,Services,s3:///prod/companies/the-value-hosted-pvt-ltd_05d90832d66e16a3c4ffc1c5f63a8776.jpg,,319,20% discount,https://s3.cryptwerk.com/discounts/2aa61e5fb79d62843bcfd31c9644b8a7.jpg,20,"Promo Code ""TOTHEMOON"" exclusive for Cryptwerk, which will give 20% recurring on all of our services",,3.6,4,Web Hosting Company,https://s3.cryptwerk.com/companies/the-value-hosted-pvt-ltd_05d90832d66e16a3c4ffc1c5f63a8776.jpg,,,,,,,,,,,,,,,
6404,34.048408,-118.252957,"3904 Cumberland Ave Los Angeles, California, 90027",https://click.cryptwerk.com/company-website/6404/,5799,I49 Seed Bank,i49-seed-bank,85.25,235,9,9,cbd-products,CBD products,144,9,9,health,Health,s3:///prod/companies/i49-seed-bank_137e0b97dc12be72b9e292991a06c006.jpg,,431,CHEAP MARIJUANA SEEDS,https://s3.cryptwerk.com/discounts/42f8e3d91065b269b428ffee7d75932d.jpg,0,Buy Cheap Marijuana Seeds Online,,4.3,5,Selling high quality cannabis seeds for souvenir purposes in discrete packaging. We are a Seed bank that ships to the USA from California so that you do not have to worry about customs! We also...,https://s3.cryptwerk.com/companies/i49-seed-bank_137e0b97dc12be72b9e292991a06c006.jpg,163,9,9,home-garden,"Home, garden",206,9,9,pharmacy,Pharmacy,164,9,9,smoking,Smoking
6404,34.048408,-118.252957,"3904 Cumberland Ave Los Angeles, California, 90027",https://click.cryptwerk.com/company-website/6404/,5799,I49 Seed Bank,i49-seed-bank,85.25,235,9,9,cbd-products,CBD products,144,9,9,health,Health,s3:///prod/companies/i49-seed-bank_137e0b97dc12be72b9e292991a06c006.jpg,,432,10% discount,https://s3.cryptwerk.com/discounts/27ebf5f917d50c91af6acc2ebf8350c4.jpg,10,10% off for cannabis seeds with TAKE10NOW coupon,,4.3,5,Selling high quality cannabis seeds for souvenir purposes in discrete packaging. We are a Seed bank that ships to the USA from California so that you do not have to worry about customs! We also...,https://s3.cryptwerk.com/companies/i49-seed-bank_137e0b97dc12be72b9e292991a06c006.jpg,163,9,9,home-garden,"Home, garden",206,9,9,pharmacy,Pharmacy,164,9,9,smoking,Smoking
6404,34.048408,-118.252957,"3904 Cumberland Ave Los Angeles, California, 90027",https://click.cryptwerk.com/company-website/6404/,5799,I49 Seed Bank,i49-seed-bank,85.25,235,9,9,cbd-products,CBD products,144,9,9,health,Health,s3:///prod/companies/i49-seed-bank_137e0b97dc12be72b9e292991a06c006.jpg,,433,$10 discount,https://s3.cryptwerk.com/discounts/a64ae58801f4825edebb05a10b10ff77.jpg,0,get $10 discount,,4.3,5,Selling high quality cannabis seeds for souvenir purposes in discrete packaging. We are a Seed bank that ships to the USA from California so that you do not have to worry about customs! We also...,https://s3.cryptwerk.com/companies/i49-seed-bank_137e0b97dc12be72b9e292991a06c006.jpg,163,9,9,home-garden,"Home, garden",206,9,9,pharmacy,Pharmacy,164,9,9,smoking,Smoking
6405,36.0614033,-95.8236565,"2608 West Kenosha St. Broken Arrow, Oklahoma, 74012",https://click.cryptwerk.com/company-website/6405/,5800,Kind Seed Co,weed-seeds-canada,73.08,235,9,9,cbd-products,CBD products,164,9,9,smoking,Smoking,s3:///prod/companies/weed-seeds-canada_c08911cdb209d3c7ed2d3641a327e175.jpg,,,,,,,,3.7,4,Selling high quality cannabis seeds for souvenir purposes in discrete packaging. We ship from USA to USA so that you do not have to worry about customs! We also ship worldwide when you call...,https://s3.cryptwerk.com/companies/weed-seeds-canada_c08911cdb209d3c7ed2d3641a327e175.jpg,,,,,,,,,,,,,,,
29,32.7782096,-96.798684,"400 S. Akard, Dallas, Texas, 75201",https://click.cryptwerk.com/company-website/29/,24,Coinhost.io Web Services,coinhost,90.29,66,22,22,domains,Domains,26,22,22,hosting,Hosting,s3:///prod/companies/coinhost_5c7f28b03718fa34611e2cfe2e569e37.jpg,,137,3 months hosting for FREE,https://s3.cryptwerk.com/discounts/397c0f29bee07d8c735269bc9b7aefca.jpg,0,"Please join our simple hosting using the coupon code JOIN, first-month free. Sign up to get an extra 2-MONTHS FREE!",,4.5,5,"Cryptocurrency Accepted, Privacy Respected.",https://s3.cryptwerk.com/companies/coinhost_5c7f28b03718fa34611e2cfe2e569e37.jpg,,,,,,,,,,,,,,,
29,32.7782096,-96.798684,"400 S. Akard, Dallas, Texas, 75201",https://click.cryptwerk.com/company-website/29/,24,Coinhost.io Web Services,coinhost,90.29,66,22,22,domains,Domains,26,22,22,hosting,Hosting,s3:///prod/companies/coinhost_5c7f28b03718fa34611e2cfe2e569e37.jpg,,248,Refer a friend and earn 15%,https://s3.cryptwerk.com/discounts/36a01c4dd2884a021e79d9a830c54c73.jpg,0,Refer a friend and earn 15% pain in Bitcoin. For the lifetime of your referrals.,,4.5,5,"Cryptocurrency Accepted, Privacy Respected.",https://s3.cryptwerk.com/companies/coinhost_5c7f28b03718fa34611e2cfe2e569e37.jpg,,,,,,,,,,,,,,,
2904,35.13938,-80.9787482,11201 Ed Brown Rd Charlotte 28273 North Carolina United States,https://click.cryptwerk.com/company-website/2904/,2888,Print-ted Store,print-ted-store,80.77,127,9,9,clothing,"Clothing, fashion",163,9,9,home-garden,"Home, garden",s3:///prod/companies/print-ted-store_37099c82dbb0d77d41339a95a59ec59a.jpg,,,,,,,,4,5,"Online store selling printed or embroidered apparels and accessories. Home, kitchen and jewelry also.",https://s3.cryptwerk.com/companies/print-ted-store_37099c82dbb0d77d41339a95a59ec59a.jpg,,,,,,,,,,,,,,,
7546,34.053044,-118.24375,"6247 Randolph St. Los Angeles, CA",https://click.cryptwerk.com/company-website/7546/,6941,High Life Goods,high-life-goods,61.54,164,9,9,smoking,Smoking,,,,,,s3:///prod/companies/high-life-goods_971cdde10f82d881ce430d0ce570673d.jpg,,,,,,,,3.1,4,Large selection of smoking Glass Bongs and Dab Rigs,https://s3.cryptwerk.com/companies/high-life-goods_971cdde10f82d881ce430d0ce570673d.jpg,,,,,,,,,,,,,,,
952,37.308514,-120.4803148,2334 M Street #3011 Merced. CA.USA .95344,https://click.cryptwerk.com/company-website/952/,936,Elliemei.com,elliemei-com,88.46,127,9,9,clothing,"Clothing, fashion",,,,,,s3:///prod/companies/elliemei-com_c381842ad62138d514f76aa195a4618b.jpg,,323,10% off,https://s3.cryptwerk.com/discounts/f8975d7b7786f8343bff615722d27235.jpg,10,Sign up for new arrivals and get 10% discount coupon,,4.4,5,"Ellie Mei - Designer Dresses High Fashion Low Price Free Shipping. Ellie Mei Designer Dresses High Fashion Low Price .Elegant .Stylish, High Quality . Women's clothing. Resort Wear. Evening Gowns...",https://s3.cryptwerk.com/companies/elliemei-com_c381842ad62138d514f76aa195a4618b.jpg,,,,,,,,,,,,,,,
952,37.308514,-120.4803148,2334 M Street #3011 Merced. CA.USA .95344,https://click.cryptwerk.com/company-website/952/,936,Elliemei.com,elliemei-com,88.46,127,9,9,clothing,"Clothing, fashion",,,,,,s3:///prod/companies/elliemei-com_c381842ad62138d514f76aa195a4618b.jpg,,324,Women Clothing On Sale,https://s3.cryptwerk.com/discounts/9cdcb125c81d864d77314315b47d8a7e.jpg,30,Special deals for women clothing in our store!,,4.4,5,"Ellie Mei - Designer Dresses High Fashion Low Price Free Shipping. Ellie Mei Designer Dresses High Fashion Low Price .Elegant .Stylish, High Quality . Women's clothing. Resort Wear. Evening Gowns...",https://s3.cryptwerk.com/companies/elliemei-com_c381842ad62138d514f76aa195a4618b.jpg,,,,,,,,,,,,,,,
1037,31.6184484,-84.217011,"2601 Dawson Road Space B-8 Albany, GA 31707",https://click.cryptwerk.com/company-website/1037/,1021,Reeds.com,reeds-com,80.77,125,9,9,jewelry,Jewelries,,,,,,s3:///prod/companies/reeds-com_38aadcc945bfb5a4bc770b5407544229.jpg,,77,Watch and Jewelry Clearance Sale,https://s3.cryptwerk.com/discounts/c8bcc07185a4844c20a1f05839f91cea.jpg,0,"Exceptional style usually comes at a price, but that doesn’t mean you can’t find a sale! Our jewelry and watches sale is the perfect way to get your hands on the latest styles and jewelry designers – all while sticking to your budget.",,4,5,"Trusted for over 60 years, shop REEDS Jewelers for the best prices on diamonds, engagement rings, wedding bands, charms, watches, gemstone and gold jewelry.",https://s3.cryptwerk.com/companies/reeds-com_38aadcc945bfb5a4bc770b5407544229.jpg,,,,,,,,,,,,,,,
1979,34.146464,-118.235713,"101 N Verdugo Rd #11701 Glendale, CA 91226",https://click.cryptwerk.com/company-website/1979/,1962,Eliquid Stop,eliquid-stop,65.38,164,9,9,smoking,Smoking,,,,,,s3:///prod/companies/eliquid-stop_51df0d80af28f5c9495ffc0b8ab2829a.jpg,,116,5% off + free shipping,https://s3.cryptwerk.com/discounts/c5ee0bd52b089cb3a9f61814969a347d.jpg,5,GET 5% OFF + Free Shipping. Check our sales page!,,3.3,4,"Our online store brings you a great selection of vapor cigarette juice and e-liquids for sale. We offer the best products available in the market, coming straight from the top e-liquid brands....",https://s3.cryptwerk.com/companies/eliquid-stop_51df0d80af28f5c9495ffc0b8ab2829a.jpg,,,,,,,,,,,,,,,
1950,47.393231,-122.221355,"Invicta Business Park Gillingham, Kent, ME8 6PG",https://click.cryptwerk.com/company-website/1950/,1933,Level 5 Domains,level-5-domains,61.54,66,22,22,domains,Domains,26,22,22,hosting,Hosting,s3:///prod/companies/level-5-domains_ba388d654fe18dd75b850d32f9cd243c.jpg,,,,,,,,3.1,4,"Level 5 Domains has been providing website services for over 10 years.  Services include; domain registration, website hosting, reseller hosting, and dedicated servers.",https://s3.cryptwerk.com/companies/level-5-domains_ba388d654fe18dd75b850d32f9cd243c.jpg,,,,,,,,,,,,,,,
1943,42.395763,-71.174279,"Muscle Gravy LLC, Suite 201,  405 Concord Avenue, Belmont, MA 02478",https://click.cryptwerk.com/company-website/1943/,1926,Muscle Gravy,muscle-gravy,50,76,9,9,food,"Food, drinks",,,,,,s3:///prod/companies/muscle-gravy_572682fef81cf78aeff1f4f382d4c7b0.jpg,,,,,,,,2.5,3,Muscle Gravy is a powder that you mix with water to replace a meal. Muscle Gravy is designed for people who have difficulty putting on weight due to low appetite and a fast metabolism.,https://s3.cryptwerk.com/companies/muscle-gravy_572682fef81cf78aeff1f4f382d4c7b0.jpg,,,,,,,,,,,,,,,
2931,34.050128,-118.047809,"1855 Tyler Ave. Unit C, South El Monte, CA 91733",https://click.cryptwerk.com/company-website/2931/,2915,Lushes Curtains,lushes-curtains,76.92,163,9,9,home-garden,"Home, garden",,,,,,s3:///prod/companies/lushes-curtains_5a09785aef84c613033facdfe304f70e.jpg,,5,Get 5% OFF + FREE Shipping,https://s3.cryptwerk.com/discounts/189ec0dd2930ca8cb0e1b98d7eab61f7.jpg,5,Coupon Code can only be used once per customer. Coupon code & only be used on our website and will not work towards any custom orders. In order to receive the discount you must submit the coupon code at checkout where indicated. Can NOT be combine with any other offer or applied to submitted orders.,,3.8,4,"Custom Made Velvet Curtains For Your Home, Business or Special Event! Delivering Elegant & Quality Velvet Curtains Since 2011",https://s3.cryptwerk.com/companies/lushes-curtains_5a09785aef84c613033facdfe304f70e.jpg,,,,,,,,,,,,,,,
1869,34.959208,-116.419389,"Southern California, CA, USA",https://click.cryptwerk.com/company-website/1869/,1852,The Need Want Shop,the-need-want-shop,42.31,110,9,9,souvenirs,Souvenirs,153,148,148,toys-souvenirs,Toys & souvenirs,s3:///prod/companies/the-need-want-shop_c9efc76dd82cdf1718e74ab6c124eb7b.jpg,,,,,,,,2.1,3,"We’re your local online retailer. Providing only best and diverse selection of clothing for all ages. Located in Southern California, we’re also one of the few places that accepts...",https://s3.cryptwerk.com/companies/the-need-want-shop_c9efc76dd82cdf1718e74ab6c124eb7b.jpg,,,,,,,,,,,,,,,
1884,37.09024,-95.712891,United States,https://click.cryptwerk.com/company-website/1884/,1867,Your Favorite Gadgets,your-favorite-gadgets,53.85,109,9,9,computers,Electronics,,,,,,s3:///prod/companies/your-favorite-gadgets_dd03c50180bd4bb4406e3dc42981a518.jpg,,,,,,,,2.7,3,We are here to bring you the hottest trending gadgets on the market at the best possible prices. Get your next Favorite Gadget today!,https://s3.cryptwerk.com/companies/your-favorite-gadgets_dd03c50180bd4bb4406e3dc42981a518.jpg,,,,,,,,,,,,,,,
1893,37.09024,-95.712891,United States,https://click.cryptwerk.com/company-website/1893/,1876,Tarriss,Tarriss,57.69,98,9,9,internet-shops,Different stores,158,43,43,different-travel,Different,s3:///prod/companies/Tarriss_5e6325ba3caf486846fc797f5f44c730.jpg,,,,,,,,2.9,3,Simple Solutions To A Complicated World,https://s3.cryptwerk.com/companies/Tarriss_5e6325ba3caf486846fc797f5f44c730.jpg,,,,,,,,,,,,,,,
1911,40.782604,-73.950677,"PO Box 287042,  New York, NY 10128 USA",https://click.cryptwerk.com/company-website/1911/,1894,Tenacious Toys,tenacious-toys,73.08,230,9,9,gifts,Gifts,153,148,148,toys-souvenirs,Toys & souvenirs,s3:///prod/companies/tenacious-toys_18f546c200e7bb5cdd2945a498d2bdc7.jpg,,49,Get rewards points and turn them into a discount,https://s3.cryptwerk.com/discounts/f60c6d0104a1dc98485753cd9fa32b83.jpg,0,"All customers who log into their TenaciousToys.com account before ordering will be automatically assigned rewards points.

Those points are worth 10% of the value of your order. For example, place a $200 order and receive points worth $20.",,3.7,4,"We love vinyl art toys as well as handcrafted resin sculptures, and we always try to offer a wide selection of both for your shopping pleasure. Additionally, you will find a rotating collection of...",https://s3.cryptwerk.com/companies/tenacious-toys_18f546c200e7bb5cdd2945a498d2bdc7.jpg,,,,,,,,,,,,,,,
1911,40.782604,-73.950677,"PO Box 287042,  New York, NY 10128 USA",https://click.cryptwerk.com/company-website/1911/,1894,Tenacious Toys,tenacious-toys,73.08,230,9,9,gifts,Gifts,153,148,148,toys-souvenirs,Toys & souvenirs,s3:///prod/companies/tenacious-toys_18f546c200e7bb5cdd2945a498d2bdc7.jpg,,859,10% off your first order!,https://s3.cryptwerk.com/discounts/1d6eb3608796c615d5323359240112ab.jpg,10,"Get 10% off your first order!
Sign up to get a code for 10% off your first order!",,3.7,4,"We love vinyl art toys as well as handcrafted resin sculptures, and we always try to offer a wide selection of both for your shopping pleasure. Additionally, you will find a rotating collection of...",https://s3.cryptwerk.com/companies/tenacious-toys_18f546c200e7bb5cdd2945a498d2bdc7.jpg,,,,,,,,,,,,,,,
6336,45.519435,-122.671402,"STE 835385 11923 NE Sumner Street Portland, Oregon 97220 United States",https://click.cryptwerk.com/company-website/6336/,5731,EyeSeeAll Binoculars,eyeseeall-binoculars,53.85,98,9,9,internet-shops,Different stores,109,9,9,computers,Electronics,s3:///prod/companies/eyeseeall-binoculars_5aa98b6209126f0a86fed33fb698106f.jpg,,,,,,,,2.7,3,Experience & Capture Quality Action From Afar,https://s3.cryptwerk.com/companies/eyeseeall-binoculars_5aa98b6209126f0a86fed33fb698106f.jpg,,,,,,,,,,,,,,,
5972,32.715696,-117.154587,"3245 University Ave Ste 1245, San Diego, CA 92104, US",https://click.cryptwerk.com/company-website/5972/,5398,T.C. Johnston,t-c-johnston-ll-m-internet-law,65.38,166,113,113,different-b2b-services,Different,,,,,,s3:///prod/companies/t-c-johnston-ll-m-internet-law_18f07ddb8ca1c46bcd42f7b71fcad3b4.jpg,,,,,,,,3.3,4,"Internet and technology law, transactions, consulting, general business litigation | T.C. Johnston, LL.M. - Civil Litigator with Emphasis on Technology",https://s3.cryptwerk.com/companies/t-c-johnston-ll-m-internet-law_18f07ddb8ca1c46bcd42f7b71fcad3b4.jpg,,,,,,,,,,,,,,,
5817,34.094345,-118.326637,"1509 Vine St, Hollywood, CA 90028, US",https://click.cryptwerk.com/company-website/5817/,5275,Wynn Nail Spa,wynn-nail-spa,57.69,173,160,160,health-services,"Health, beauty",231,160,160,beauty-saloons,Beauty saloons,s3:///prod/companies/wynn-nail-spa_07a9c350c6f40e14f5910ee277a2d21f.jpg,,,,,,,,2.9,3,"The premier destination for nail services with locations in the heart of Hollywood, the Miracle Mile district of Los Angeles and the South Park district of downtown Los Angeles.",https://s3.cryptwerk.com/companies/wynn-nail-spa_07a9c350c6f40e14f5910ee277a2d21f.jpg,,,,,,,,,,,,,,,
5851,34.063025,-118.362525,"5600 Wilshire Blvd, Los Angeles, CA 90036, US",,5275,Wynn Nail Spa,wynn-nail-spa,57.69,173,160,160,health-services,"Health, beauty",231,160,160,beauty-saloons,Beauty saloons,s3:///prod/companies/wynn-nail-spa_07a9c350c6f40e14f5910ee277a2d21f.jpg,,,,,,,,2.9,3,"The premier destination for nail services with locations in the heart of Hollywood, the Miracle Mile district of Los Angeles and the South Park district of downtown Los Angeles.",https://s3.cryptwerk.com/companies/wynn-nail-spa_07a9c350c6f40e14f5910ee277a2d21f.jpg,,,,,,,,,,,,,,,
5817,34.094345,-118.326637,"1509 Vine St, Hollywood, CA 90028, US",https://click.cryptwerk.com/company-website/5817/,5275,Wynn Nail Spa,wynn-nail-spa,57.69,173,160,160,health-services,"Health, beauty",231,160,160,beauty-saloons,Beauty saloons,s3:///prod/companies/wynn-nail-spa_07a9c350c6f40e14f5910ee277a2d21f.jpg,,,,,,,,2.9,3,"The premier destination for nail services with locations in the heart of Hollywood, the Miracle Mile district of Los Angeles and the South Park district of downtown Los Angeles.",https://s3.cryptwerk.com/companies/wynn-nail-spa_07a9c350c6f40e14f5910ee277a2d21f.jpg,,,,,,,,,,,,,,,
5851,34.063025,-118.362525,"5600 Wilshire Blvd, Los Angeles, CA 90036, US",,5275,Wynn Nail Spa,wynn-nail-spa,57.69,173,160,160,health-services,"Health, beauty",231,160,160,beauty-saloons,Beauty saloons,s3:///prod/companies/wynn-nail-spa_07a9c350c6f40e14f5910ee277a2d21f.jpg,,,,,,,,2.9,3,"The premier destination for nail services with locations in the heart of Hollywood, the Miracle Mile district of Los Angeles and the South Park district of downtown Los Angeles.",https://s3.cryptwerk.com/companies/wynn-nail-spa_07a9c350c6f40e14f5910ee277a2d21f.jpg,,,,,,,,,,,,,,,
4149,40.703922,-73.947527,"428 Lorimer St, Brooklyn, NY 11206, US",https://click.cryptwerk.com/company-website/4149/,3971,De Wine Spot,de-wine-spot,65.38,76,9,9,food,"Food, drinks",,,,,,s3:///prod/companies/de-wine-spot_d360fa5c5a8eed342365605bde666f55.jpg,,,,,,,,3.3,4,"East Williamsburg wine, sake and spirits shop. Unique, small-batch wines; curated collection of scotch, whiskey and bourbons; sake collection; Wine Searcher tool",https://s3.cryptwerk.com/companies/de-wine-spot_d360fa5c5a8eed342365605bde666f55.jpg,,,,,,,,,,,,,,,
5096,29.9552478,-90.0671103,"322 Royal St, New Orleans, LA 70130, US",https://click.cryptwerk.com/company-website/5096/,4684,David's Antiques,david-s-antiques,34.62,125,9,9,jewelry,Jewelries,,,,,,s3:///prod/companies/david-s-antiques_44421cb870d6de94e23785e31b06dead.jpg,,,,,,,,1.7,2,"David's Antiques and Jewelry 322 Royal Street New Orleans, LA",https://s3.cryptwerk.com/companies/david-s-antiques_44421cb870d6de94e23785e31b06dead.jpg,,,,,,,,,,,,,,,
7516,29.702995,-98.124182,343 Stone Point New Braunfels TX 78130,https://click.cryptwerk.com/company-website/7516/,6911,Saving Pearls Jewelry,saving-pearls-jewelry,65.38,127,9,9,clothing,"Clothing, fashion",125,9,9,jewelry,Jewelries,s3:///prod/companies/saving-pearls-jewelry_35dc7fd2f3384607bff69a24cefdb2a7.jpg,,,,,,,,3.3,4,"Saving Pearls sells beautiful pearl jewelry, and donates 50% of the profits to Fight Human Trafficking.",https://s3.cryptwerk.com/companies/saving-pearls-jewelry_35dc7fd2f3384607bff69a24cefdb2a7.jpg,,,,,,,,,,,,,,,
7558,34.035934,-117.856225,"340 S Lemon Ave #1045, Walnut, CA 91789",https://click.cryptwerk.com/company-website/7558/,6953,OrgPack,orgpack,42.31,26,22,22,hosting,Hosting,151,148,148,servers,Servers,s3:///prod/companies/orgpack_8f2442dfe1e900952c6d2ab01cd3ca58.jpg,,,,,,,,2.1,3,Talk.  Text.  Host.  High quality hosting for your organization.,https://s3.cryptwerk.com/companies/orgpack_8f2442dfe1e900952c6d2ab01cd3ca58.jpg,,,,,,,,,,,,,,,
7170,34.168397,-118.604783,"47 Ventura Blvd, Woodland Hills, CA 91364, USA",https://click.cryptwerk.com/company-website/7170/,6565,Twoscoopspress.com,twoscoopspress-com,23.08,166,113,113,different-b2b-services,Different,,,,,,s3:///prod/companies/twoscoopspress-com_db6216743252da6fba4ed728bd27dd02.jpg,,,,,,,,1.2,2,Two Scoops Press is the indie publishing company behind Two Scoops of Django: Best Practices For Django. We specialize in Python and Django books and courses.,https://s3.cryptwerk.com/companies/twoscoopspress-com_db6216743252da6fba4ed728bd27dd02.jpg,,,,,,,,,,,,,,,
7727,42.722183,-84.5521211,"1027 S. Washington Ave, Lansing, MI 48910",https://click.cryptwerk.com/company-website/7727/,7122,Odd Nodd Art Supply,odd-nodd-art-supply,57.69,167,9,9,art,Art,23,9,9,marketplaces,Marketplaces,s3:///prod/companies/odd-nodd-art-supply_36a03e0242389e0d150d6fa5d6d83d7d.jpg,,,,,,,,2.9,3,Art supplies and materials.,https://s3.cryptwerk.com/companies/odd-nodd-art-supply_36a03e0242389e0d150d6fa5d6d83d7d.jpg,,,,,,,,,,,,,,,
7782,28.0034273,-82.5981002,6328 Newtown Cir A-4,https://click.cryptwerk.com/company-website/7782/,7177,247vcc,247vcc,25,124,9,9,software,Software,,,,,,s3:///prod/companies/247vcc_78f8c8d084e06cdb4794e0f06dbe8017.jpg,,,,,,,,1.3,2,"We are Selling Virtual credit card VCC PAYPAL VCC RELOADABLE VCC , Virtual bank paypal vba, Reloadable Vcc for online payment,Verified PayPal Account ,Verified Skrill, stealth eBay, Verified...",https://s3.cryptwerk.com/companies/247vcc_78f8c8d084e06cdb4794e0f06dbe8017.jpg,,,,,,,,,,,,,,,
6699,30.737939,-85.51305,"982 Hutchins Ln, Chipley, FL 32428, USA",https://click.cryptwerk.com/company-website/6699/,6094,Arrowheadbeef.com,arrowheadbeef-com,50,76,9,9,food,"Food, drinks",,,,,,s3:///prod/companies/arrowheadbeef-com_595e2d43f8149b907781021ea8f11c2b.jpg,,,,,,,,2.5,3,Are you looking for pure grass-fed beef? We follow the American Grass Fed Association;s feeding standards for beef which not only means 100% Grass Fed AND Grass-Finished but all livestock are also...,https://s3.cryptwerk.com/companies/arrowheadbeef-com_595e2d43f8149b907781021ea8f11c2b.jpg,,,,,,,,,,,,,,,
6715,32.7747243,-117.1275094,"3111 Camino Del Rio N, San Diego, CA 92108, USA",https://click.cryptwerk.com/company-website/6715/,6110,Cali-burrito.com,cali-burrito-com,57.69,127,9,9,clothing,"Clothing, fashion",,,,,,s3:///prod/companies/cali-burrito-com_e0c49378efb7fddd7a4b9ef3e66deaa8.jpg,,,,,,,,2.9,3,"Shop California Burrito Flag T-Shirts, Tank Tops, Hats, Bags, Stickers, Patches and Gifts for Cali Burrito. Official Cali Burrito Flag Store from San Diego, California.",https://s3.cryptwerk.com/companies/cali-burrito-com_e0c49378efb7fddd7a4b9ef3e66deaa8.jpg,,,,,,,,,,,,,,,
6819,36.1553573,-95.9846209,"502 E 3rd St, Tulsa, OK 74120, USA",https://click.cryptwerk.com/company-website/6819/,6214,Stemcelltulsa.com,stemcelltulsa-com,65.38,98,9,9,internet-shops,Different stores,230,9,9,gifts,Gifts,s3:///prod/companies/stemcelltulsa-com_0c06815d7f5dea7648f56cdf05eeea98.jpg,,,,,,,,3.3,4,"A store specializing in all things scientific, including laboratory equipment, artifacts, gifts, and housewares.",https://s3.cryptwerk.com/companies/stemcelltulsa-com_0c06815d7f5dea7648f56cdf05eeea98.jpg,110,9,9,souvenirs,Souvenirs,,,,,,,,,,
7889,34.0522342,-118.2436849,"Los Angeles, USA",https://click.cryptwerk.com/company-website/7889/,7283,Smooth,smooth,46.15,150,148,148,keys,Keys,,,,,,s3:///prod/companies/smooth_66bc0b4e743262d4175687997915b609.jpg,,,,,,,,2.3,3,"Our Smooth Team is selling exclusive skins reliable, safe and fast. We completed more than 100+ orders and we have a 100% success rate. We have never had a costumer not get their order or not...",https://s3.cryptwerk.com/companies/smooth_66bc0b4e743262d4175687997915b609.jpg,,,,,,,,,,,,,,,
