address_id,lat,lng,address,website,id,title,url,rating,categories.0.id,categories.0.parent_id,categories.0.root,categories.0.url,categories.0.title,categories.1.id,categories.1.parent_id,categories.1.root,categories.1.url,categories.1.title,image_url,premium,discount_id,discount_title,discount_image_url,discount_discount,discount_text,rating_stars,rating_number,rating_color,description,logo,categories.2.id,categories.2.parent_id,categories.2.root,categories.2.url,categories.2.title,categories.3.id,categories.3.parent_id,categories.3.root,categories.3.url,categories.3.title,categories.4.id,categories.4.parent_id,categories.4.root,categories.4.url,categories.4.title
1216,28.9214,-111.594285,"BitDice Casino S.L.R.  San Jose, Costa Rica",https://click.cryptwerk.com/company-website/1216/,1200,BitDice,bitdice,78.85,139,137,137,casino,Casino,142,137,137,dice,Dice,s3:///prod/companies/bitdice_53ee52ff769037b8ce9f1ca8288f5e15.jpg,,,,,,,,3.9,4,"BitDice is a provably dice and casino website with many special features like a private messaging service, account ranking system and comprehensive user statistics. Users can bet on dice and...",https://s3.cryptwerk.com/companies/bitdice_53ee52ff769037b8ce9f1ca8288f5e15.jpg,,,,,,,,,,,,,,,
1892,41.392289,-81.742751,"7705 Ackley Rd, Parma, OH 44129, USA",https://click.cryptwerk.com/company-website/1892/,1875,Eugenius Vision - Cleveland SEO,eugenius-vision-cleveland-Seo,73.08,154,113,113,design,Design,93,113,113,development,Web development,s3:///prod/companies/eugenius-vision-cleveland-Seo_286026917531c28be6f35c9d437765c0.jpg,,,,,,,,3.7,4,"euGenius Vision is the Top Cleveland search engine optimization company. Besides Cleveland SEO services, euGenius Vision offers State of the Art webdesign!",https://s3.cryptwerk.com/companies/eugenius-vision-cleveland-Seo_286026917531c28be6f35c9d437765c0.jpg,220,215,215,agencies,Agencies,,,,,,,,,,
1951,46.729553,-94.6859,"Minnesota, USA",https://click.cryptwerk.com/company-website/1951/,1934,CryptoCloaks,cryptocloaks,73.08,98,9,9,internet-shops,Different stores,109,9,9,computers,Electronics,s3:///prod/companies/cryptocloaks_db89e2d3e032a9bfa9302d3f66ca31d1.jpg,,154,No tax when paying with Bitcoin,https://s3.cryptwerk.com/discounts/dfd72a848c2bd34496ac9e581271a688.jpg,0,Don't pay any tax if you choose to pay with BTC or BTC.LN,,3.7,4,"Keeping your crypto hidden, secure and protected.",https://s3.cryptwerk.com/companies/cryptocloaks_db89e2d3e032a9bfa9302d3f66ca31d1.jpg,,,,,,,,,,,,,,,
2932,36.233776,-115.241562,"304 S Jones Blvd #465 Las Vegas, Nevada",https://click.cryptwerk.com/company-website/2932/,2916,CoinRating,coinrating,46.15,103,112,11,analytics,Analytics,,,,,,s3:///prod/companies/coinrating_486ccb9af18c78c2e01748f05b1440d5.jpg,,,,,,,,2.3,3,CoinRating is a live coin rating platform.,https://s3.cryptwerk.com/companies/coinrating_486ccb9af18c78c2e01748f05b1440d5.jpg,,,,,,,,,,,,,,,
1848,33.494749,-111.932932,"Phoe4214 East Indian School Road, Phoenix, Arizona 85018, United Statesnix, AZ, USA",https://click.cryptwerk.com/company-website/1848/,1831,RYJO Digital,ryjo-digital,34.62,114,113,113,marketing-ads-pr,"Marketing, Ads, PR",220,215,215,agencies,Agencies,s3:///prod/companies/ryjo-digital_7a34a0d4ae7768008a52d6b9a8a42856.jpg,,,,,,,,1.7,2,"RYJO Digital is a full service SEO and Internet Marketing Company based in Phoenix, AZ with clients across the United States. We are passionate about generating leads for our clients and helping...",https://s3.cryptwerk.com/companies/ryjo-digital_7a34a0d4ae7768008a52d6b9a8a42856.jpg,216,215,215,seo,SEO,,,,,,,,,,
1915,37.09024,-95.712891,United States,https://click.cryptwerk.com/company-website/1915/,1898,Crypto Posters,crypto-posters,50,127,9,9,clothing,"Clothing, fashion",110,9,9,souvenirs,Souvenirs,s3:///prod/companies/crypto-posters_8702458e9d00dbb80774a0f6a39664e6.jpg,,,,,,,,2.5,3,"We’re massive supporters of CRYPTO and will always invest profits back into the crypto YOU support. You buy a NEO poster.. we buy NEO! We proudly accept payment in BTC, LTC & ETH and are...",https://s3.cryptwerk.com/companies/crypto-posters_8702458e9d00dbb80774a0f6a39664e6.jpg,,,,,,,,,,,,,,,
49,29.7967062,-95.5615066,"10685-B Hazelhurst Dr. # 15644 Houston, TX 77043",https://click.cryptwerk.com/company-website/49/,41,Dialwebhosting.com,dialwebhosting-com,53.85,120,22,22,cloud,Cloud,66,22,22,domains,Domains,s3:///prod/companies/dialwebhosting-com_2c722575f07cf6e4dfb2d9fa151c9553.jpg,,,,,,,,2.7,3,DialWebHosting is one of the leading web hosting provider offering cost-effective shared web hosting service. You can call us at 1-888-288-3570 any time to avail our affordable web hosting service.,https://s3.cryptwerk.com/companies/dialwebhosting-com_2c722575f07cf6e4dfb2d9fa151c9553.jpg,26,22,22,hosting,Hosting,,,,,,,,,,
863,34.0522342,-118.2436849,"Los Angeles, CA",https://click.cryptwerk.com/company-website/863/,850,BitRoses,bitroses,30.77,98,9,9,internet-shops,Different stores,,,,,,s3:///prod/companies/bitroses_7185f339aa5f997affaf617298e1dad1.jpg,,,,,,,,1.5,2,Buy Flowers with Bitcoin,https://s3.cryptwerk.com/companies/bitroses_7185f339aa5f997affaf617298e1dad1.jpg,,,,,,,,,,,,,,,
5937,34.192407,-119.178581,"1000 Town Center Drive Ste 300, Oxnard, CA 93036, US",https://click.cryptwerk.com/company-website/5937/,5367,Law Office of Charlotte C Lin,law-office-of-charlotte-c-lin,57.69,179,160,160,legal,Legal,,,,,,s3:///prod/companies/law-office-of-charlotte-c-lin_ea57a973722c6b581c6b2a20fd8a4316.jpg,,,,,,,,2.9,3,"DUI, Traffic, Immigration attorney serving Ventura County. Call  (805) 517-4529 for Affordable full-service representation.",https://s3.cryptwerk.com/companies/law-office-of-charlotte-c-lin_ea57a973722c6b581c6b2a20fd8a4316.jpg,,,,,,,,,,,,,,,
4321,43.654056,-79.340014,"3299 Lake Shore Blvd, Toronto, ON M8V 1M4, CA",https://click.cryptwerk.com/company-website/4321/,4107,Coworking Space Toronto,coworking-space-toronto,30.77,194,160,160,coworking,Coworking,,,,,,s3:///prod/companies/coworking-space-toronto_7d79422b21c94445b420eb4bb66059a5.jpg,,,,,,,,1.5,2,"toll raods, gardiner, bitcoin,john tory,coworking, coop, co-working,Event Space, Conference, After party, Coworking,Bitcoin, Bitcoins, Co-working, Toronto, Coworking Toronto, Coworking Space...",https://s3.cryptwerk.com/companies/coworking-space-toronto_7d79422b21c94445b420eb4bb66059a5.jpg,,,,,,,,,,,,,,,
4564,41.949614,-87.643816,"Chicago, IL, US",https://click.cryptwerk.com/company-website/4564/,4303,Fetch Portraits,fetch-portraits,34.62,187,160,160,pets,Pets,182,160,160,photo,Photo,s3:///prod/companies/fetch-portraits_73ba650e9283e254a72a1156ff591d63.jpg,,,,,,,,1.7,2,Fetch Portraits Chicago Dog Photographer,https://s3.cryptwerk.com/companies/fetch-portraits_73ba650e9283e254a72a1156ff591d63.jpg,,,,,,,,,,,,,,,
6428,28.948299,-81.298988,"Orange City, FL",https://click.cryptwerk.com/company-website/6428/,5823,Orlando CBD Plus,orlando-cbd-plus,30.77,235,9,9,cbd-products,CBD products,144,9,9,health,Health,s3:///prod/companies/orlando-cbd-plus_faf1510b21fbf5f158873b8d9a49d535.jpg,,,,,,,,1.5,2,Premium CBD Vapes Oils Edibles Pets,https://s3.cryptwerk.com/companies/orlando-cbd-plus_faf1510b21fbf5f158873b8d9a49d535.jpg,206,9,9,pharmacy,Pharmacy,,,,,,,,,,
6429,28.948299,-81.298988,"Orange City, FL",https://click.cryptwerk.com/company-website/6429/,5824,Mamba Streams,mamba-streams,23.08,124,9,9,software,Software,90,22,22,web-services,Services,s3:///prod/companies/mamba-streams_d5c81e9a4d6d96f09d2c1010e8294a43.jpg,,,,,,,,1.2,2,Today's Premier IPTV Service. Order And Sign Up For Advanced Streaming Services,https://s3.cryptwerk.com/companies/mamba-streams_d5c81e9a4d6d96f09d2c1010e8294a43.jpg,,,,,,,,,,,,,,,
7573,35.230594,-80.84719,"Charlotte, NC",https://click.cryptwerk.com/company-website/7573/,6968,DogeSwag,dogeswag,50,127,9,9,clothing,"Clothing, fashion",110,9,9,souvenirs,Souvenirs,s3:///prod/companies/dogeswag_7202d43ef4b0313d8b7d7f66358dff78.jpg,,,,,,,,2.5,3,"Doge Swag is your very online store for unique dogecoin T-Shirt, doge merch & such more",https://s3.cryptwerk.com/companies/dogeswag_7202d43ef4b0313d8b7d7f66358dff78.jpg,,,,,,,,,,,,,,,
7028,30.261616,-85.9627387,"Florida Ln, Panama City Beach, FL 32413, USA",https://click.cryptwerk.com/company-website/7028/,6423,Vapepenssstore.com,vapepenssstore-com,76.92,164,9,9,smoking,Smoking,,,,,,s3:///prod/companies/vapepenssstore-com_8c6b636b95cd414b6fe37029ac91f8cc.jpg,,111,Special discounts on our sale page,https://s3.cryptwerk.com/discounts/2d482bb76c01a47e436302394cf5f6a9.jpg,0,Get special prices  + Free shipping on all orders!,,3.8,4,"High quality vaporizers, atomizers, and mods",https://s3.cryptwerk.com/companies/vapepenssstore-com_8c6b636b95cd414b6fe37029ac91f8cc.jpg,,,,,,,,,,,,,,,
7713,38.557993,-121.436248,Español,https://click.cryptwerk.com/company-website/7713/,7108,CriptoMckee -  Inversiones en Criptomonedas,criptomckee-inversiones-en-criptomonedas,53.85,207,113,113,blockchain,Blockchain,180,113,113,consulting,Consulting,s3:///prod/companies/criptomckee-inversiones-en-criptomonedas_2f04d5bed8b151abded5f7169890992c.jpg,,,,,,,,2.7,3,Plataformas de inversion en cripto activos de alta rentabilidad-,https://s3.cryptwerk.com/companies/criptomckee-inversiones-en-criptomonedas_2f04d5bed8b151abded5f7169890992c.jpg,,,,,,,,,,,,,,,
7769,32.8063638,-96.8359442,Manuel Pascual,,7164,Difinite tatto Studio,difinite-tatto-studio,42.31,196,160,160,tatoo-piercing,"Tatoo, piercing",,,,,,s3:///prod/companies/difinite-tatto-studio_d5328bdf7c06ba5f1f77e75702827a8e.jpg,,,,,,,,2.1,3,Diseños profesionales a la mano de nuestros clientes,https://s3.cryptwerk.com/companies/difinite-tatto-studio_d5328bdf7c06ba5f1f77e75702827a8e.jpg,,,,,,,,,,,,,,,
7918,47.0158428,-122.877386,"3525 McCormick St SE, Olympia, WA 98501",https://click.cryptwerk.com/company-website/7918/,7312,Centerless Imagery,centerless-imagery,73.08,93,113,113,development,Web development,220,215,215,agencies,Agencies,s3:///prod/companies/centerless-imagery_2a372a6ef37fdd22bed0de3544b77997.jpg,,,,,,,,3.7,4,"We create virtual tours (mobile/desktop/VR), utilizing 360°, high-quality, HDR images, for businesses and properties.",https://s3.cryptwerk.com/companies/centerless-imagery_2a372a6ef37fdd22bed0de3544b77997.jpg,221,215,215,different-marketing,Different,,,,,,,,,,
7937,40.4936726,-111.8892301,"14193 S Minuteman Drive Suite 201 Draper, UT 84020",https://click.cryptwerk.com/company-website/7937/,7331,TaxBit,taxbit,57.69,207,113,113,blockchain,Blockchain,189,113,113,finance,Finance,s3:///prod/companies/taxbit_d2e8a48212a9ca63125ca0f75db62368.jpg,,,,,,,,2.9,3,"Refund-maximizing, Cryptocurrency Tax Software You Can Depend On",https://s3.cryptwerk.com/companies/taxbit_d2e8a48212a9ca63125ca0f75db62368.jpg,,,,,,,,,,,,,,,
1716,42.867598,-71.036482,"77 S Main St #538 Newton, NH 03858",https://click.cryptwerk.com/company-website/1716/,1699,MyCryptoCheckout,mycryptocheckout-com,71.15,99,11,11,payment-gateway,Payment gateways,,,,,,s3:///prod/companies/mycryptocheckout-com_e5690d9de6aa9fa0aee5964fe0d1b80b.jpg,,,,,,,,3.6,4,"Accept Bitcoin, Ethereum, Litecoin, and 95+ other coins in WooCommerce and Easy Digital Downloads. 0% transaction fees. Use any crypto wallet. Peer-to-peer transactions. No KYC.",https://s3.cryptwerk.com/companies/mycryptocheckout-com_e5690d9de6aa9fa0aee5964fe0d1b80b.jpg,,,,,,,,,,,,,,,
1700,41.1342632,-104.8205721,"1908 Thomes Ave Cheyenne, WY 82001 USA",https://click.cryptwerk.com/company-website/1700/,1683,Paykassa.pro,paykassa-pro,50,99,11,11,payment-gateway,Payment gateways,69,11,11,wallets,Wallets,s3:///prod/companies/paykassa-pro_51b090360194a2c03fdc3a3f161ab1ad.jpg,,,,,,,,2.5,3,"PayKassa - the first aggregator of payments Bitcoin, Ethereum, Dash, Litecoin and others Plug quickly - take instantly!",https://s3.cryptwerk.com/companies/paykassa-pro_51b090360194a2c03fdc3a3f161ab1ad.jpg,,,,,,,,,,,,,,,
8079,45.5348429,-122.647913,"1724 NE Broadway Street #539, Portland, Oregon 97232-1428",https://click.cryptwerk.com/company-website/8079/,7473,Mind Geographic,mind-geographic,42.31,204,22,22,edu,Edu,45,160,160,internet-education,Education,s3:///prod/companies/mind-geographic_057a0cc8d67a9e6040d82459a8e2025a.jpg,,,,,,,,2.1,3,"Neurodiversity-positive, nonsectarian spiritual direction",https://s3.cryptwerk.com/companies/mind-geographic_057a0cc8d67a9e6040d82459a8e2025a.jpg,,,,,,,,,,,,,,,
8159,37.0921127,-93.8244267,Mauricio Ramírez,https://click.cryptwerk.com/company-website/8159/,7553,Gana con Proyectos,gana-con-proyectos,30.77,90,22,22,web-services,Services,,,,,,s3:///prod/companies/gana-con-proyectos_cb6857ff4fcd6f6b3ec992646e946519.jpg,,,,,,,,1.5,2,Encuentra las mejores páginas para ganar dinero.O adquiere cursos premium económicos.,https://s3.cryptwerk.com/companies/gana-con-proyectos_cb6857ff4fcd6f6b3ec992646e946519.jpg,,,,,,,,,,,,,,,
8175,40.7446298,-73.987667,"244 Fifth Avenue, New York, NY, 10001, United States",https://click.cryptwerk.com/company-website/8175/,7569,ServerWhere.com,serverwhere-com,75,120,22,22,cloud,Cloud,26,22,22,hosting,Hosting,s3:///prod/companies/serverwhere-com_a10bcbe0f0032c32c5cdae3209fbc9c2.jpg,18,689,10% Off Cloud Servers,https://s3.cryptwerk.com/discounts/669c72112fca6d55f4b116a2284570e7.jpg,10,Get 10% off ServerWhere's Cloud Server plans. Choose a location between U.S. Europe and Asia.,,3.8,4,ServerWhere.com (SW) is a cryptocurrencies based business platform for provisioning of Cloud infrastructure & Dedicated server hosting.,https://s3.cryptwerk.com/companies/serverwhere-com_a10bcbe0f0032c32c5cdae3209fbc9c2.jpg,,,,,,,,,,,,,,,
8252,42.1462795,-88.1340572,207 East hill side ave,https://click.cryptwerk.com/company-website/8252/,7646,Cryptoxcoin,cryptoxcoin,30.77,13,11,11,exchanges,Spot Exchanges,112,11,11,trading-investment-ico,"News, analytics",s3:///prod/companies/cryptoxcoin_53556c498d3db92ab61499954aed8818.jpg,,,,,,,,1.5,2,It is a crypto trading site design for crypto exchange thanks,https://s3.cryptwerk.com/companies/cryptoxcoin_53556c498d3db92ab61499954aed8818.jpg,,,,,,,,,,,,,,,
1092,38.722199,-77.536287,Bristow  VA20136 USA,https://click.cryptwerk.com/company-website/1092/,1075,Sakamaonline.com,sakamaonline-com,57.69,127,9,9,clothing,"Clothing, fashion",,,,,,s3:///prod/companies/sakamaonline-com_237761a03c9ad2d30593e616546d9ad0.jpg,,,,,,,,2.9,3,"A leader in the rug and leather wholesale industry since 1976, sakamaonline.com is dedicated to bringing you high-quality rugs, leather, and home interiors solution from around the world at...",https://s3.cryptwerk.com/companies/sakamaonline-com_237761a03c9ad2d30593e616546d9ad0.jpg,,,,,,,,,,,,,,,
880,36.0997956,-115.1206128,"2375 E Tropicana #416 Las Vegas NV, 89119",https://click.cryptwerk.com/company-website/880/,865,Amagimetals.com,amagimetals-com,65.38,226,9,9,precious-metals,Precious metals,,,,,,s3:///prod/companies/amagimetals-com_ed9668882cd5463288ef5a1b5157b410.jpg,,,,,,,,3.3,4,"Buy Gold, Silver Coins, Bars and Bullion Online | Best Prices on Precious Metals - Amagi Metals",https://s3.cryptwerk.com/companies/amagimetals-com_ed9668882cd5463288ef5a1b5157b410.jpg,,,,,,,,,,,,,,,
1036,30.2752533,-98.1512463,"217 Stonegate Ln. Dripping Springs, TX 78620-3338 United States of America",https://click.cryptwerk.com/company-website/1036/,1020,Allgamer.net,allgamer-net,42.31,27,9,9,gaming,For gamers,26,22,22,hosting,Hosting,s3:///prod/companies/allgamer-net_40ee3b6e3d92a9d614be7189c46a1b91.jpg,,,,,,,,2.1,3,"Game Server Hosting, Virtual Dedicated Servers, Dedicated Servers, Mumble Servers, and Web Hosting - Allgamer",https://s3.cryptwerk.com/companies/allgamer-net_40ee3b6e3d92a9d614be7189c46a1b91.jpg,151,148,148,servers,Servers,,,,,,,,,,
2012,37.09024,-95.712891,USA,https://click.cryptwerk.com/company-website/2012/,1995,HippTee Shirts,hipptee-shirts,46.15,110,9,9,souvenirs,Souvenirs,,,,,,s3:///prod/companies/hipptee-shirts_e021600f85fbf1f61dcdfe0945378485.jpg,,,,,,,,2.3,3,HippTee Shirts is an Crypto Only Hipp Shirt Store.,https://s3.cryptwerk.com/companies/hipptee-shirts_e021600f85fbf1f61dcdfe0945378485.jpg,,,,,,,,,,,,,,,
2043,37.09024,-95.712891,USA,https://click.cryptwerk.com/company-website/2043/,2026,Cryptograffiti,cryptograffiti,42.31,110,9,9,souvenirs,Souvenirs,,,,,,s3:///prod/companies/cryptograffiti_fd1676302105f3933b74c79ddb8dd6c2.jpg,,,,,,,,2.1,3,Cryptograffiti is an artist and early Bitcoin enthusiast.  His work is dedicated to spreading the cryptocurrency/blockchain movement.,https://s3.cryptwerk.com/companies/cryptograffiti_fd1676302105f3933b74c79ddb8dd6c2.jpg,,,,,,,,,,,,,,,
1963,39.768403,-86.158068,"Indianapolis, IN, USA",https://click.cryptwerk.com/company-website/1963/,1946,GPS Tracking Made Easy,gps-tracking-made-easy,57.69,135,9,9,auto,"Auto, bikes, vehicles",109,9,9,computers,Electronics,s3:///prod/companies/gps-tracking-made-easy_eb8f5ad17299e7a891074c3e992db797.jpg,,,,,,,,2.9,3,"GPS tracking devices shouldn't be complicated. Let us help you protect your car, truck, van, RV, trailer, motorcycle, or nearly anything else. Two year warranty, one-on-one installation help,...",https://s3.cryptwerk.com/companies/gps-tracking-made-easy_eb8f5ad17299e7a891074c3e992db797.jpg,,,,,,,,,,,,,,,
1227,40.71598,-74.002881,"New York, New York",https://click.cryptwerk.com/company-website/1227/,1211,Offshorededicated,offshorededicated,73.08,26,22,22,hosting,Hosting,233,22,22,iptv,IPTV,s3:///prod/companies/offshorededicated_dd5d0945ee73666ec19f7bc49ed387fc.jpg,,413,Special cryptwerk Offer,https://s3.cryptwerk.com/discounts/a506b32b3771fbceee4f51bdbb446c03.jpg,5,5% Off Recurring. Special offer for cryptwerk for indefinite time.,,3.7,4,"DMCA Ignored Hosting Provider. We are committed to provide reliable anonymous offshore hosting with protection from any encroachment, maintaining our client’s rights to full freedom of...",https://s3.cryptwerk.com/companies/offshorededicated_dd5d0945ee73666ec19f7bc49ed387fc.jpg,,,,,,,,,,,,,,,
111,30.1660736,-81.706484,"P.O. Box 1851 Brandon, Orange Park, FL 32073",https://click.cryptwerk.com/company-website/111/,104,HostYD,hostyd,65.38,66,22,22,domains,Domains,26,22,22,hosting,Hosting,s3:///prod/companies/hostyd_d23d3940512c1f797f71015ef88558dc.jpg,,,,,,,,3.3,4,"Providing very reliable hosting services with cPanel, Softaculous, easy WebsiteBuilders, unlimited web space, unlimited data transfer and a free domain!",https://s3.cryptwerk.com/companies/hostyd_d23d3940512c1f797f71015ef88558dc.jpg,111,22,22,ssl,SSL,,,,,,,,,,
2955,45.498301,-73.5685,"3136 Boulevard Chèvremont, Montréal, QC H9C 2W7, Canada",https://click.cryptwerk.com/company-website/2955/,2939,Nexwave.ca,nexwave-ca,50,66,22,22,domains,Domains,26,22,22,hosting,Hosting,s3:///prod/companies/nexwave-ca_3fc5b0fc9cfc04dbd7b8049d31069e33.jpg,,,,,,,,2.5,3,"Web hosting for businesses in the province of Quebec. Secure your online presence, geo-position your website & on-demand technical support",https://s3.cryptwerk.com/companies/nexwave-ca_3fc5b0fc9cfc04dbd7b8049d31069e33.jpg,,,,,,,,,,,,,,,
2986,33.158094,-117.350186,"Carlsbad California, USA",https://click.cryptwerk.com/company-website/2986/,2970,101vape,101vape-com,57.69,164,9,9,smoking,Smoking,,,,,,s3:///prod/companies/101vape-com_3c57ef65ef29fda2c4bee4185a116f7e.jpg,,,,,,,,2.9,3,101 Vape is the leading online Vape Store providing premium Vape Juices and E Liquids flavors from top manufactures at affordable prices.,https://s3.cryptwerk.com/companies/101vape-com_3c57ef65ef29fda2c4bee4185a116f7e.jpg,,,,,,,,,,,,,,,
6440,43.689032,-79.301575,Bani Zaid St./main Street,https://click.cryptwerk.com/company-website/6440/,5835,VPNShazam,vpnshazam,78.85,122,22,22,proxy,Proxy,102,22,22,vpn,VPN,s3:///prod/companies/vpnshazam_1da254377b7fe045e049b96d81f1b60a.jpg,,247,Turbo VPN packages,https://s3.cryptwerk.com/discounts/b301ad0220308e9f8b202bd34cbeb715.jpg,72,"3 months plan - get 25% discount
12 months plan - get 50% discount
24 months plan - get 70% discount",,3.9,4,Turbo Dynamic and Dedicated IPs VPN,https://s3.cryptwerk.com/companies/vpnshazam_1da254377b7fe045e049b96d81f1b60a.jpg,,,,,,,,,,,,,,,
7426,43.674794,-81.301585,Walton.,https://click.cryptwerk.com/company-website/7426/,6821,Host Mayo,host-mayo,46.15,66,22,22,domains,Domains,26,22,22,hosting,Hosting,s3:///prod/companies/host-mayo_36ea078cc2e5a6a8bc32bfa2c933674b.jpg,,,,,,,,2.3,3,Hosting for smart peoples!,https://s3.cryptwerk.com/companies/host-mayo_36ea078cc2e5a6a8bc32bfa2c933674b.jpg,,,,,,,,,,,,,,,
7423,33.196198,-117.378582,"1906 Oceanside Blvd, oceanside California, 92027",https://click.cryptwerk.com/company-website/7423/,6818,Firearms Unknown,firearms-unknown,69.23,193,9,9,sport-stores,Sports,,,,,,s3:///prod/companies/firearms-unknown_578afc43ac6e650bbcd828eefc4ff147.jpg,,389,Black friday sale,https://s3.cryptwerk.com/discounts/c5a3bcced23721ea707f75cbd65ff7ed.jpg,50,Black Friday Daily Deals,,3.5,4,Guns and 80 percent builds,https://s3.cryptwerk.com/companies/firearms-unknown_578afc43ac6e650bbcd828eefc4ff147.jpg,,,,,,,,,,,,,,,
7442,35.148095,-90.043189,"200 Jefferson Ave, Ste 225 Memphis, TN 38103",https://click.cryptwerk.com/company-website/7442/,6837,"Osborn Psychiatry, PLLC",osborn-psychiatry-pllc,38.46,170,160,160,medicine,Medicine,,,,,,s3:///prod/companies/osborn-psychiatry-pllc_61a1a6d6f75192cabdd14de0b26384fc.jpg,,,,,,,,1.9,2,Private practice psychiatry,https://s3.cryptwerk.com/companies/osborn-psychiatry-pllc_61a1a6d6f75192cabdd14de0b26384fc.jpg,,,,,,,,,,,,,,,
8263,37.7952421,-122.403654,"US, San Francisco, 655 Montgomery St",https://click.cryptwerk.com/company-website/8263/,7657,FanVestor,fanvestor,65.38,211,11,11,different-crypto-services,Different,,,,,,s3:///prod/companies/fanvestor_2702440e5f4f618511a6196b7e8dada0.jpg,,,,,,,,3.3,4,FanVestor - Crowdfunding Application,https://s3.cryptwerk.com/companies/fanvestor_2702440e5f4f618511a6196b7e8dada0.jpg,,,,,,,,,,,,,,,
7673,39.7122374,-75.6488059,"508 Main Street, Wilmington, Delaware 19804",https://click.cryptwerk.com/company-website/7673/,7068,Hablax,hablax,69.23,130,22,22,refill-mobile,Refill,123,22,22,sms,SMS,s3:///prod/companies/hablax_f0726652993d18f9f3cbff0bd6ba7f33.jpg,,,,,,,,3.5,4,"Send mobile recharges and internet top-ups, make international calls and send sms all over the world.",https://s3.cryptwerk.com/companies/hablax_f0726652993d18f9f3cbff0bd6ba7f33.jpg,121,22,22,voip,VoIP,,,,,,,,,,
8327,45.4354254,-122.5618752,"10121 SE Sunnyside Road STE 335 Clackamas, OR 97015",https://click.cryptwerk.com/company-website/8327/,7721,Fymhotsauce.rocks,fymhotsauce-rocks,61.54,76,9,9,food,"Food, drinks",,,,,,s3:///prod/companies/fymhotsauce-rocks_e06c486e6e95e356ef4cbd2c18be9ac5.jpg,,,,,,,,3.1,4,Best Hot Sauce ever from Portland Oregon.,https://s3.cryptwerk.com/companies/fymhotsauce-rocks_e06c486e6e95e356ef4cbd2c18be9ac5.jpg,,,,,,,,,,,,,,,
1914,33.448377,-112.074037,"Phoenix, AZ, USA",https://click.cryptwerk.com/company-website/1914/,1897,Cryptocurrency Posters,cryptocurrency-posters,61.54,110,9,9,souvenirs,Souvenirs,,,,,,s3:///prod/companies/cryptocurrency-posters_ccb6bd3b505507b97b68a5be70df4dda.jpg,,,,,,,,3.1,4,"Cryptocurrency Posters is committed to providing fine, crypto-themed artwork. We specialize in crypto posters but also offer crypto backpacks, crypto socks, crypto pillows, and more.",https://s3.cryptwerk.com/companies/cryptocurrency-posters_ccb6bd3b505507b97b68a5be70df4dda.jpg,,,,,,,,,,,,,,,
7837,28.010769,-80.6726611,112 americana blvd,https://click.cryptwerk.com/company-website/7837/,7231,Ghostmixer,ghostmixer,54.48,211,11,11,different-crypto-services,Different,,,,,,s3:///prod/companies/ghostmixer_930890ac5288272d1b464be3dd46fad3.jpg,,,,,,,,2.7,3,Bitcoin mixing service,https://s3.cryptwerk.com/companies/ghostmixer_930890ac5288272d1b464be3dd46fad3.jpg,,,,,,,,,,,,,,,
7911,28.0303462,-82.4597581,8872 n. Florida ave.,https://click.cryptwerk.com/company-website/7911/,7305,Greg's Botanical,greg-s-botanical,61.54,235,9,9,cbd-products,CBD products,76,9,9,food,"Food, drinks",s3:///prod/companies/greg-s-botanical_81f01fbe568fba4d2e57556defcdcf97.jpg,,26,10% off for all kratom not already on sale,https://s3.cryptwerk.com/discounts/c9f5f77ca060c7b2c5af517b79363d93.jpg,10,All Kratom not already on sale with crtpyo-hurry and grab some now,,3.1,4,Kratom and CBD Business. We ship worldwide. 3rd party tested. 100% satisfaction guaranteed.,https://s3.cryptwerk.com/companies/greg-s-botanical_81f01fbe568fba4d2e57556defcdcf97.jpg,144,9,9,health,Health,206,9,9,pharmacy,Pharmacy,,,,,
7981,28.0108228,-80.6726801,112 americana blvd,https://click.cryptwerk.com/company-website/7981/,7375,BitWhisk,bitwhisk,71.15,211,11,11,different-crypto-services,Different,,,,,,s3:///prod/companies/bitwhisk_a022c19afbfb2d367c342eaba72e77b8.jpg,,,,,,,,3.6,4,BitWhisk – Fast and secure Bitcoin mixer designed to defend your privacy.,https://s3.cryptwerk.com/companies/bitwhisk_a022c19afbfb2d367c342eaba72e77b8.jpg,,,,,,,,,,,,,,,
8545,35.5174913,-86.5804473,Punаnе tn 56 • Tаllinn • Estоnіа 13619,https://click.cryptwerk.com/company-website/8545/,7939,Filecat.net,filecat-net,38.46,145,22,22,different,Different,90,22,22,web-services,Services,s3:///prod/companies/filecat-net_4cc01242da1d91bf8075df5841173ba4.jpg,,,,,,,,1.9,2,"Store With Comfort, Security, Speed, Convenience!",https://s3.cryptwerk.com/companies/filecat-net_4cc01242da1d91bf8075df5841173ba4.jpg,,,,,,,,,,,,,,,
